City,Hotel name,Image,Url,Address,Stars,Min Price,Rating,Number of reviews,Reviews,Facilities,Description,Nearby places
Vũng Tàu,Nhà nghỉ Hạnh Minh,"['https://ik.imagekit.io/tvlk/apr-asset/dgXfoyh24ryQLRcGq00cIdKHRmotrWLNlvG-TxlcLxGkiDwaUSggleJNPRgIHCX6/hotel/asset/67741896-2560x1920-FIT_AND_TRIM-fd22b5b9b6381fa49592d9252f458044.jpeg?_src=imagekit&tr=c-at_max,h-488,q-40,w-768', 'https://ik.imagekit.io/tvlk/apr-asset/dgXfoyh24ryQLRcGq00cIdKHRmotrWLNlvG-TxlcLxGkiDwaUSggleJNPRgIHCX6/hotel/asset/67741896-2560x1920-FIT_AND_TRIM-909de1505af0c59ac5dd8c8b7c0d5002.jpeg?_src=imagekit&tr=h-116,q-40,w-152', 'https://ik.imagekit.io/tvlk/apr-asset/dgXfoyh24ryQLRcGq00cIdKHRmotrWLNlvG-TxlcLxGkiDwaUSggleJNPRgIHCX6/hotel/asset/67741896-1280x960-FIT_AND_TRIM-edcd948ce3b6dcd31a32915f9669cf41.jpeg?_src=imagekit&tr=h-116,q-40,w-152', 'https://ik.imagekit.io/tvlk/apr-asset/dgXfoyh24ryQLRcGq00cIdKHRmotrWLNlvG-TxlcLxGkiDwaUSggleJNPRgIHCX6/hotel/asset/67741896-1280x960-FIT_AND_TRIM-4536e9f0e1f16e3c5ed3ef9597f84908.jpeg?_src=imagekit&tr=h-116,q-40,w-152', 'https://ik.imagekit.io/tvlk/apr-asset/dgXfoyh24ryQLRcGq00cIdKHRmotrWLNlvG-TxlcLxGkiDwaUSggleJNPRgIHCX6/hotel/asset/67741896-1280x960-FIT_AND_TRIM-ad7db9b9e7a96f1dd473ce3809299867.jpeg?_src=imagekit&tr=h-116,q-40,w-152']","https://www.traveloka.com/vi-vn/hotel/vietnam/hanh-minh-guest-house-3000020015077?spec=16-07-2022.17-07-2022.1.1.HOTEL.3000020015077.Nh%C3%A0%20ngh%E1%BB%89%20H%E1%BA%A1nh%20Minh.1&prevSearchId=1736845221741755406&loginPromo=1&contexts=%7B%22inventoryRateKey%22%3A%22povEwB3ZzsU2C6pd%2B6MdU13LUNuufACdbU0usK5vg0dM0tKsNUio4Rxug1zOzHJilcvZa8YdqqIySdppe7dolTIewZlxfjiOGz6oXLTucMvN0%2BgQ3yZPvZcoHwUFNN%2BZpcr%2F%2FNa8o9ElfN8zOYhzzZeg0X586laFpeUViPi9rxBhUobGX41%2FTWPY0UNT0sR%2FmhLDdV0WLeT%2FFKfQ0QL8LH02Dvlx%2F8PjYogEE5yzx6g6yOKyKeIDf7jO3GM45O1ok5sYzsZdVhL8yLD1ILOp6Q%3D%3D%22%7D
","Lê Văn Lương, Côn Đảo (Hòn Sơn), Bà Rịa - Vũng Tàu, Việt Nam, 790000",1,400.000  VND,8.9,41,"['Chỗ ở rộng, sạch sẽ thoáng mát, lại ngay trung tâm nên tiện di chuyển. Chị chủ thân thiện nhiệt tình.', 'Phòng sạch sẽ - Chị chủ rất nhiệt tình. Chuyến bay chra chúng tôi đến sớm (7h sáng) chị chủ đã sắp xếp phòng cho chúng tôi nghỉ ngơi sớm. BT sẽ là 2h chiều . \n\nĐây là lần thứ 2 đặt phòng tại đây. Rất cảm ơn nhà nghỉ Hạnh Minh. Mọi người ghé ủng hộ chị chủ nhé ', 'Phòng rộng rãi thoáng mát sạch sẽ, giá cả hợp lý. Chị chủ dễ thương nhiệt tình.', 'Phòng cực kì sạch sẽ và dễ chịu, không có cảm giác ngột ngạt và bí bách như trong phòng kháchsạn kín, vì có ban công và cửa sổ thoáng. Mình ngủ rất ngon ở đây. anh chị chủ cũng rất dễ thương, nếu ghé thăm lại côn đảo mình cũng sẽ ở đây', 'Chị chủ thân thiện, rất rất nhiệt tình hướng dẫn mọi thứ, sẵn lòng giúp đỡ mọi người, Rất cảm ơn Chị', 'Phòng cực đẹp cô chủ cực gần gũi thân thiện và dễ tính, lo lắng cho khách như người nhà.Rất thích cô chủ ở đây.Tốt tính hiếu khách. Nếu có dịp nhất định sẽ ghé thăm ủng hộ cô.', 'phòng không như hình, trên hình phòng 3 người có gát lửng, có lò vi sóng, khi nhận phòng không có, nhà nghỉ kế bên chỗ bida rất ồn ào, suốt đêm không ngủ được', 'Anh chị chủ nhà rất thân thiện. Phòng rộng rãi, sạch sẽ.', 'tôi rất hài lòng. khách sạn gần trung tâm.sạch sẽ. 3p di bo la den ngay cho con Dao. chị chủ rất nhiệt tình và dễ thương.thue xe máy tại kháchsạn 100k. sẽ quay lại lần sau', 'khách sạn gần các khu di tích,tiện đi lại, chủ nhà nghỉ thân thiện, phòng sạch sẽ']","['Máy lạnh', 'WiFi']","Giờ nhận và trả phòng
Giờ nhận phòng: 14:00 - 22:00
Giờ trả phòng: 07:00 - 12:00
Bạn muốn nhận phòng bên ngoài khung giờ quy định (ví dụ như sáng sớm hoặc tối muộn)? Bạn có thể thoả thuận trực tiếp với nơi lưu trú!
Vị trí
Hanh Minh Guest House là một khách sạn nằm trong khu vực an ninh, toạ lạc tại Côn Đảo (Hòn Sơn).","[('Trại giam Phú Hải', '279 m'), ('Sân bay Côn Đảo (VCS)', '5.56 km'), ('Trại giam Phú Hải', '279 m'), ('Vườn quốc gia Côn Đảo', '2.03 km'), ('Bãi biển Đất Dốc', '2.58 km'), ('Sân bay Côn Đảo (VCS)', '5.56 km')]"
Vũng Tàu,Khách sạn Hoa Sen Vũng Tàu,"['https://ik.imagekit.io/tvlk/apr-asset/dgXfoyh24ryQLRcGq00cIdKHRmotrWLNlvG-TxlcLxGkiDwaUSggleJNPRgIHCX6/hotel/asset/67705522-3288x2183-FIT_AND_TRIM-14c31415487a56c6fc6bd884649df013.jpeg?_src=imagekit&tr=c-at_max,h-488,q-40,w-768', 'https://ik.imagekit.io/tvlk/apr-asset/dgXfoyh24ryQLRcGq00cIdKHRmotrWLNlvG-TxlcLxGkiDwaUSggleJNPRgIHCX6/hotel/asset/67705522-3288x2183-FIT_AND_TRIM-51a0ca70cd64493955c1513617b2e81c.jpeg?_src=imagekit&tr=h-116,q-40,w-152', 'https://ik.imagekit.io/tvlk/apr-asset/dgXfoyh24ryQLRcGq00cIdKHRmotrWLNlvG-TxlcLxGkiDwaUSggleJNPRgIHCX6/hotel/asset/67705522-1854x2793-FIT_AND_TRIM-bd177a855f261f7ea3c1ea2d5d76a50e.jpeg?_src=imagekit&tr=h-116,q-40,w-152', 'https://ik.imagekit.io/tvlk/apr-asset/dgXfoyh24ryQLRcGq00cIdKHRmotrWLNlvG-TxlcLxGkiDwaUSggleJNPRgIHCX6/hotel/asset/67705522-2288x1519-FIT_AND_TRIM-0c21e31e3742e51cc6e274dae1247071.jpeg?_src=imagekit&tr=h-116,q-40,w-152', 'https://ik.imagekit.io/tvlk/apr-asset/dgXfoyh24ryQLRcGq00cIdKHRmotrWLNlvG-TxlcLxGkiDwaUSggleJNPRgIHCX6/hotel/asset/10022934-3288x2183-FIT_AND_TRIM-08593c4483bc2ec80393b9a93a12bb4b.jpeg?_src=imagekit&tr=h-116,q-40,w-152']","https://www.traveloka.com/vi-vn/hotel/vietnam/lotus-apartment-hotel-1000000542340?spec=16-07-2022.17-07-2022.1.1.HOTEL.1000000542340.Kh%C3%A1ch%20s%E1%BA%A1n%20Hoa%20Sen%20V%C5%A9ng%20T%C3%A0u.1&prevSearchId=1736845221741755406&loginPromo=1&contexts=%7B%22inventoryRateKey%22%3A%22povEwB3ZzsU2C6pd%2B6MdU13LUNuufACdbU0usK5vg0dM0tKsNUio4Rxug1zOzHJilcvZa8YdqqIySdppe7dolTIewZlxfjiOGz6oXLTucMvN0%2BgQ3yZPvZcoHwUFNN%2BZpcr%2F%2FNa8o9ElfN8zOYhzzZeg0X586laFpeUViPi9rxBS2c%2BZxI9%2FHnfoQ6mXbSTXmhLDdV0WLeT%2FFKfQ0QL8LH02Dvlx%2F8PjYogEE5yzx6g6yOKyKeIDf7jO3GM45O1ok5sYzsZdVhL8yLD1ILOp6Q%3D%3D%22%7D
","6/11 Nguyễn Du, Phường 1, Phường 1, Thành phố Vũng Tàu, Bà Rịa - Vũng Tàu, Việt Nam, 790000",2,911.000  VND,9.0,98,"['Nhân viên vui vẻ, nhiệt tình giúp xách hành lý khi thấy có trẻ nhỏ đi cùng. 3 sao nhưng đầy đủ tiện nghi', 'Vị trí đẹp, gần bãi biển. Phòng rộng rãi và có đầy đủ các trang thiết bị nấu nướng, giặt giũ... Rất thích hợp cho gia đình.', 'Khách sạn sạch sẽ, có chỗ nấu ăn trong phòng, nhân viên nhiệt tình', 'Sạch đep, đầy đủ tiện nghi, phòng thoáng mát', 'Khách sạn này rất sạch và lễ tân rất chu đáo, mình đánh giá là rất phù hợp cho kỳ nghỉ của gia đình. Tuy nhiên mình có góp ý là cửa sổ lùa không có rào chắn song nên rất nguy hiểm cho gia đình có em bé thích khám phá. Mình sẽ trở lại khách sạn cho kỳ nghỉ sắp tới. Cám ơn Traveloka !', 'Tôi vô tình tìm được trên app, Khách sạn Hoa Sen tuyệt vời, trang bị đầy đủ như bếp, máy giặt nhưng giá lại như khách sạn 2 sao bình thường, thật tuyệt. Nhân viên nhiệt tình, luôn giúp để về xe và trang thiết bị cần thiết, có luôn người giúp hành lý, thật không ngờ dịch vụ tốt như vậy ở khách sạn 2 sao với mức giá rất tốt. Xin cám ơn Hoa Sen!', 'khách sạn tốt. thân thiện nhiệt tình', 'Phòng đẹp, đầy đủ tiện nghi, tiếp tân thân thiện, vui vẻ. Gần khu ăn uống, tiện lợi', 'Nhân viên thân thiện, sạch, vị trí tiện', 'Mình ở dịp lễ  29, 30/4, thuê 2 phòng vip 401-403 phòng sạch thoáng, bé nhân viên lễ tân thân thiện rất nhiệt tình, dễ thương, mình có xin thêm nệm thêm gối thêm khách sạn ko lấy thêm tiền, có chổ ngủ cho tài xế, gần chợ xóm lưới, nói chung rất hài lòng, có dịp sẽ quay lại ']","['Máy lạnh', 'Lễ tân 24h', 'Chỗ đậu xe', 'Thang máy', 'WiFi']","Giờ nhận và trả phòng
Giờ nhận phòng: Từ 14:00
Giờ trả phòng: Trước 12:00
Vị trí
Lotus Apartment Hotel là một khách sạn nằm trong khu vực an ninh, toạ lạc tại Phường 1.
Không chỉ sở hữu vị trí đắc địa, Lotus Apartment Hotel còn là một trong những khách sạn nằm cách Front Beach chưa đầy 0,23 km và Chợ Xóm Lưới chưa đầy 0,22 km.","[('Chợ Xóm Lưới', '217 m'), ('Sân bay Vũng Tàu', '4.12 km'), ('Bãi Sau', '2.00 km'), ('Sân golf Vũng Tàu', '4.23 km'), ('Dinh Cô', '17.91 km'), ('Bãi biển Long Hải', '18.03 km')]"
Vũng Tàu,Khách sạn Minh Trang,"['https://ik.imagekit.io/tvlk/apr-asset/dgXfoyh24ryQLRcGq00cIdKHRmotrWLNlvG-TxlcLxGkiDwaUSggleJNPRgIHCX6/hotel/asset/10037916-800x1200-FIT_AND_TRIM-2720ab87b737af52f07e2e7c6fbbf6ad.jpeg?_src=imagekit&tr=c-at_max,h-488,q-40,w-768', 'https://ik.imagekit.io/tvlk/apr-asset/dgXfoyh24ryQLRcGq00cIdKHRmotrWLNlvG-TxlcLxGkiDwaUSggleJNPRgIHCX6/hotel/asset/10037916-800x438-FIT_AND_TRIM-67f25f27d4ee3da056e11ad420f42a94.png?_src=imagekit&tr=h-116,q-40,w-152', 'https://ik.imagekit.io/tvlk/apr-asset/dgXfoyh24ryQLRcGq00cIdKHRmotrWLNlvG-TxlcLxGkiDwaUSggleJNPRgIHCX6/hotel/asset/10037916-800x450-FIT_AND_TRIM-42386fe11130e896a3c8506bcab4c26b.png?_src=imagekit&tr=h-116,q-40,w-152', 'https://ik.imagekit.io/tvlk/apr-asset/dgXfoyh24ryQLRcGq00cIdKHRmotrWLNlvG-TxlcLxGkiDwaUSggleJNPRgIHCX6/hotel/asset/10037916-1600x900-FIT_AND_TRIM-ba88efbe2285a03297961af5aba71492.jpeg?_src=imagekit&tr=h-116,q-40,w-152', 'https://ik.imagekit.io/tvlk/apr-asset/dgXfoyh24ryQLRcGq00cIdKHRmotrWLNlvG-TxlcLxGkiDwaUSggleJNPRgIHCX6/hotel/asset/10037916-1600x1067-FIT_AND_TRIM-3a22d99473c0804a3bbfc045f44b12e6.jpeg?_src=imagekit&tr=h-116,q-40,w-152']","https://www.traveloka.com/vi-vn/hotel/vietnam/minh-trang-hotel-3000010037916?spec=16-07-2022.17-07-2022.1.1.HOTEL.3000010037916.Kh%C3%A1ch%20s%E1%BA%A1n%20Minh%20Trang.1&prevSearchId=1736845221741755406&loginPromo=1&contexts=%7B%22inventoryRateKey%22%3A%22povEwB3ZzsU2C6pd%2B6MdU13LUNuufACdbU0usK5vg0dM0tKsNUio4Rxug1zOzHJilcvZa8YdqqIySdppe7dolTIewZlxfjiOGz6oXLTucMvN0%2BgQ3yZPvZcoHwUFNN%2BZpcr%2F%2FNa8o9ElfN8zOYhzzZeg0X586laFpeUViPi9rxDXXSsBagf9Sit6r7LOQrTUIvEWeildVo7nbHxIWcXPVNGysXwP9P%2F6jQTjnyKeTv%2ByqYmxSenRKFEfSHS0XO3ksOocFaHL1Wb9vQXntcm%2BDw%3D%3D%22%7D
","153 Phan Chu Trinh, Phường 2, Thành phố Vũng Tàu, Bà Rịa - Vũng Tàu, Việt Nam, 791057",1,1.020.000  VND,8.4,22,"['mình chẳng bao giờ quay lại khách sạn này lần nữa. Chủ khách sạn cực kỳ thiếu thân thiện. mình biết có bạn cung đi du lich nên hỏi xem bạn thuê chung khách sạn để tiện đi chơi. vừa vào đến cổng 2 đứa bạn mình nó định lên xem phòng sạch không mới quyết định thuê thì bị bà chủ phản đối kịch liệt, với giọng rất khó nghe, nếu thuê mới được lên, không thuê thi không cho lên. vây thôi không thuê nhưng bạn mình nó mang đồ lên phòng mình gửi đồ để đi ăn cung không cho. mình thấy rất bực nên hỏi tại sao, bả kêu len rồi đập tivi nhà bả thì sao, không cho lên. mình hoang mang vô cùng, chắc chủ khách sạn này bị tâm thần, ngủ mà lo nữa đêm không biet bả có lên cơn đi chém ẩu không bạn bè lưu ý cân nhắc khi đến đây', 'Phòng nghe mùi gián, vòi sen thì nước chảy lỏn tỏn, đang ngủ giường sập, tv thì, không ghé nữa', 'Bà chủ thân thiện, vị trí Khách sạn tiện đi ra biển. Phòng 5 người ở gần lễ tân cách âm không tốt nên ồn. ', 'Nhà vệ sinh ok, phòng sạch sẽ, phục vụ phòng tốt, vui vẻ. Tôi đã ở đây là lần thứ 2. Nói chung là ổn.', 'Khách sân sạch sẽ, gần biển, rất thuận lợi, có dịp sẽ quay lại', 'Cô chủ thân thiện, nhân viên bảo vệ nhiệt tình. Thuê xe giá rẻ hơn khách sạn khác nhưng xe cũ. Phòng ốc sạch sẽ, giường lớn. Khăn trắng mới. Không có bông ngoáy tai. Ti vi màn hình lớn, máy lạnh tốt. Rất gần biển.', 'Tốt. Sạch sẽ. Tiếp tân vui vẻ.nhiệt tình. Nếu có dịp ra Vũng Tàu sẽ ở khách sạn Minh Trang', 'Khách sạn Minh Trang quá tốt so với giá tiền. Phòng rộng và thoáng, vệ sinh sạch sẽ. Nhân viên quá ư là thân thiện. Vị trí đẹp, cách biển khoảng 35m. Chỗ đỗ xe rộng rãi. Lần sau về Vùng Tàu sẽ quay lại khách sạn Minh Trang.']","['Máy lạnh', 'Chỗ đậu xe', 'Thang máy', 'WiFi']","Giờ nhận và trả phòng
Giờ nhận phòng: 14:00 - 22:00
Giờ trả phòng: 07:00 - 12:00
Bạn muốn nhận phòng bên ngoài khung giờ quy định (ví dụ như sáng sớm hoặc tối muộn)? Bạn có thể thoả thuận trực tiếp với nơi lưu trú!
Vị trí
Minh Trang Hotel toạ lạc tại khu vực / thành phố Phường 2.","[('Bãi Sau', '250 m'), ('Sân bay Vũng Tàu', '5.30 km'), ('Bãi Sau', '250 m'), ('Sân golf Vũng Tàu', '4.52 km'), ('Dinh Cô', '17.23 km'), ('Bãi biển Long Hải', '17.32 km')]"
Vũng Tàu,Minh Minh Homestay,"['https://ik.imagekit.io/tvlk/apr-asset/dgXfoyh24ryQLRcGq00cIdKHRmotrWLNlvG-TxlcLxGkiDwaUSggleJNPRgIHCX6/hotel/asset/67733192-1280x960-FIT_AND_TRIM-477d85ac87eae084bac2d1b5a4e71c03.jpeg?_src=imagekit&tr=c-at_max,h-488,q-40,w-768', 'https://ik.imagekit.io/tvlk/apr-asset/dgXfoyh24ryQLRcGq00cIdKHRmotrWLNlvG-TxlcLxGkiDwaUSggleJNPRgIHCX6/hotel/asset/20014335-d6168df97ce8b2e7e671603054f9c6ea.jpeg?_src=imagekit&tr=h-116,q-40,w-152', 'https://ik.imagekit.io/tvlk/apr-asset/dgXfoyh24ryQLRcGq00cIdKHRmotrWLNlvG-TxlcLxGkiDwaUSggleJNPRgIHCX6/hotel/asset/20014335-706bb6c8835c6d23d962dfb2dc6438fa.jpeg?_src=imagekit&tr=h-116,q-40,w-152', 'https://ik.imagekit.io/tvlk/apr-asset/dgXfoyh24ryQLRcGq00cIdKHRmotrWLNlvG-TxlcLxGkiDwaUSggleJNPRgIHCX6/hotel/asset/20014335-c51fa1f96f0445e7dd78cd5aa1867b9c.jpeg?_src=imagekit&tr=h-116,q-40,w-152', 'https://ik.imagekit.io/tvlk/apr-asset/dgXfoyh24ryQLRcGq00cIdKHRmotrWLNlvG-TxlcLxGkiDwaUSggleJNPRgIHCX6/hotel/asset/20014335-e0b6352e1f7a0c7ed537af011b48d0f7.jpeg?_src=imagekit&tr=h-116,q-40,w-152']","https://www.traveloka.com/vi-vn/hotel/vietnam/minh-minh-homestay-3000020014335?spec=16-07-2022.17-07-2022.1.1.HOTEL.3000020014335.Minh%20Minh%20Homestay.1&prevSearchId=1736845221741755406&loginPromo=1&contexts=%7B%22inventoryRateKey%22%3A%22povEwB3ZzsU2C6pd%2B6MdU13LUNuufACdbU0usK5vg0dM0tKsNUio4Rxug1zOzHJilcvZa8YdqqIySdppe7dolTIewZlxfjiOGz6oXLTucMvN0%2BgQ3yZPvZcoHwUFNN%2BZpcr%2F%2FNa8o9ElfN8zOYhzzZeg0X586laFpeUViPi9rxCdbC6SjkkG8PiwNr2zFnovmhLDdV0WLeT%2FFKfQ0QL8LH02Dvlx%2F8PjYogEE5yzx6g6yOKyKeIDf7jO3GM45O1ok5sYzsZdVhL8yLD1ILOp6Q%3D%3D%22%7D
","21 Nguyễn Huệ, Côn Đảo (Hòn Sơn), Bà Rịa - Vũng Tàu, Việt Nam, 790000",1,450.000  VND,0,9,"['Chỗ ỡ sạch sẽ, chị bé siêu dễ thương, nhiệt tình đáng để ở']","['Máy lạnh', 'Lễ tân 24h', 'Chỗ đậu xe', 'WiFi']","Giờ nhận và trả phòng
Giờ nhận phòng: Từ 12:00
Giờ trả phòng: Trước 11:30
Vị trí
Minh Minh Homestay toạ lạc tại khu vực / thành phố Côn Đảo (Hòn Sơn).
Có rất nhiều điểm tham quan lân cận như Trại giam Phú Hải ở khoảng cách 0,68 km, và Vườn quốc gia Côn Đảo ở khoảng cách 2,38 km.","[('Trại giam Phú Hải', '684 m'), ('Sân bay Côn Đảo (VCS)', '6.39 km'), ('Trại giam Phú Hải', '684 m'), ('Vườn quốc gia Côn Đảo', '2.38 km'), ('Bãi biển Đất Dốc', '3.36 km'), ('Sân bay Côn Đảo (VCS)', '6.39 km')]"
Vũng Tàu,Khương Tho Hotel,"['https://ik.imagekit.io/tvlk/apr-asset/dgXfoyh24ryQLRcGq00cIdKHRmotrWLNlvG-TxlcLxGkiDwaUSggleJNPRgIHCX6/hotel/asset/20025598-9a9b62d642b529faa91b79d1594aefd5.jpeg?_src=imagekit&tr=c-at_max,h-488,q-40,w-768', 'https://ik.imagekit.io/tvlk/apr-asset/dgXfoyh24ryQLRcGq00cIdKHRmotrWLNlvG-TxlcLxGkiDwaUSggleJNPRgIHCX6/hotel/asset/20025598-8d8979449a56629ceea67cf173c82c0e.jpeg?_src=imagekit&tr=h-116,q-40,w-152', 'https://ik.imagekit.io/tvlk/apr-asset/dgXfoyh24ryQLRcGq00cIdKHRmotrWLNlvG-TxlcLxGkiDwaUSggleJNPRgIHCX6/hotel/asset/67762532-2bfd30b9b761bd8698b7708f63e1c8ad.jpeg?_src=imagekit&tr=h-116,q-40,w-152', 'https://ik.imagekit.io/tvlk/apr-asset/dgXfoyh24ryQLRcGq00cIdKHRmotrWLNlvG-TxlcLxGkiDwaUSggleJNPRgIHCX6/hotel/asset/67762532-ce7a353a5b1972ba4e776ace5278c637.jpeg?_src=imagekit&tr=h-116,q-40,w-152', 'https://ik.imagekit.io/tvlk/apr-asset/dgXfoyh24ryQLRcGq00cIdKHRmotrWLNlvG-TxlcLxGkiDwaUSggleJNPRgIHCX6/hotel/asset/67762532-434dc2a205421a75f0c2b982edf47df3.jpeg?_src=imagekit&tr=h-116,q-40,w-152']","https://www.traveloka.com/vi-vn/hotel/vietnam/khuong-tho-hotel-9000000208214?spec=16-07-2022.17-07-2022.1.1.HOTEL.9000000208214.Kh%C6%B0%C6%A1ng%20Tho%20Hotel.1&prevSearchId=1736845221741755406&loginPromo=1&contexts=%7B%22inventoryRateKey%22%3A%22povEwB3ZzsU2C6pd%2B6MdU13LUNuufACdbU0usK5vg0dM0tKsNUio4Rxug1zOzHJilcvZa8YdqqIySdppe7dolTIewZlxfjiOGz6oXLTucMvN0%2BgQ3yZPvZcoHwUFNN%2BZpcr%2F%2FNa8o9ElfN8zOYhzzZeg0X586laFpeUViPi9rxAxsMOqZ%2FFtIWEJV9TGyy%2F2mhLDdV0WLeT%2FFKfQ0QL8LH02Dvlx%2F8PjYogEE5yzx6g6yOKyKeIDf7jO3GM45O1ok5sYzsZdVhL8yLD1ILOp6Q%3D%3D%22%7D
","Đường Nguyễn Thị Minh Khai, Côn Đảo (Hòn Sơn), Bà Rịa - Vũng Tàu, Việt Nam, 794312",1,600.000  VND,0,1,[],['WiFi'],"Giờ nhận và trả phòng
Giờ nhận phòng: 14:00 - 22:00
Giờ trả phòng: 07:00 - 12:00
Bạn muốn nhận phòng bên ngoài khung giờ quy định (ví dụ như sáng sớm hoặc tối muộn)? Bạn có thể thoả thuận trực tiếp với nơi lưu trú!
Vị trí
Lưu trú tại Khuong Tho Hotel là một lựa chọn đúng đắn khi quý khách đến thăm Côn Đảo (Hòn Sơn).","[('Trại giam Phú Hải', '337 m'), ('Sân bay Côn Đảo (VCS)', '6.00 km'), ('Trại giam Phú Hải', '337 m'), ('Vườn quốc gia Côn Đảo', '2.17 km'), ('Bãi biển Đất Dốc', '2.99 km'), ('Sân bay Côn Đảo (VCS)', '6.00 km')]"
Vũng Tàu,Ho Tram Pristine Beach,"['https://ik.imagekit.io/tvlk/apr-asset/Ixf4aptF5N2Qdfmh4fGGYhTN274kJXuNMkUAzpL5HuD9jzSxIGG5kZNhhHY-p7nw/hotel/asset/67806756-6f705a38bd8526a06eaa7560d08e7d15.jpeg?_src=imagekit&tr=c-at_max,h-488,q-40,w-768', 'https://ik.imagekit.io/tvlk/apr-asset/Ixf4aptF5N2Qdfmh4fGGYhTN274kJXuNMkUAzpL5HuD9jzSxIGG5kZNhhHY-p7nw/hotel/asset/67806756-13b2fd0aad6189a6e0bbbfcad8967249.jpeg?_src=imagekit&tr=h-116,q-40,w-152', 'https://ik.imagekit.io/tvlk/apr-asset/Ixf4aptF5N2Qdfmh4fGGYhTN274kJXuNMkUAzpL5HuD9jzSxIGG5kZNhhHY-p7nw/hotel/asset/67806756-2195d6d9760d8af66e2adb2702484b26.jpeg?_src=imagekit&tr=h-116,q-40,w-152', 'https://ik.imagekit.io/tvlk/apr-asset/Ixf4aptF5N2Qdfmh4fGGYhTN274kJXuNMkUAzpL5HuD9jzSxIGG5kZNhhHY-p7nw/hotel/asset/67806756-ba0b6d3a11616c9ff81ae23805aeb87a.jpeg?_src=imagekit&tr=h-116,q-40,w-152', 'https://ik.imagekit.io/tvlk/apr-asset/Ixf4aptF5N2Qdfmh4fGGYhTN274kJXuNMkUAzpL5HuD9jzSxIGG5kZNhhHY-p7nw/hotel/asset/67806756-1713da5a5809bb1d2bfdf15dcfd0d873.jpeg?_src=imagekit&tr=h-116,q-40,w-152']","https://www.traveloka.com/vi-vn/hotel/vietnam/ho-tram-pristine-beach-9000000961910?spec=16-07-2022.17-07-2022.1.1.HOTEL.9000000961910.Ho%20Tram%20Pristine%20Beach.1&prevSearchId=1736845221741755406&loginPromo=1&contexts=%7B%22inventoryRateKey%22%3A%22povEwB3ZzsU2C6pd%2B6MdU13LUNuufACdbU0usK5vg0dM0tKsNUio4Rxug1zOzHJilcvZa8YdqqIySdppe7dolTIewZlxfjiOGz6oXLTucMvN0%2BgQ3yZPvZcoHwUFNN%2BZpcr%2F%2FNa8o9ElfN8zOYhzzZeg0X586laFpeUViPi9rxCdcKoydbIxETSOuwCCtCE4IvEWeildVo7nbHxIWcXPVNGysXwP9P%2F6jQTjnyKeTv%2ByqYmxSenRKFEfSHS0XO3ksOocFaHL1Wb9vQXntcm%2BDw%3D%3D%22%7D
","Tổ 10, Ấp Hồ Tràm, Xã Phước Thuận, Huyện Xuyên Mộc, Thành phố Vũng Tàu, Xuyên Mộc, Bà Rịa - Vũng Tàu, Việt Nam, 78000",1,1.500.000  VND,0,2,[],"['Máy lạnh', 'WiFi']","Giờ nhận và trả phòng
Giờ nhận phòng: 12:30 - 23:30
Giờ trả phòng: 07:00 - 12:00
Bạn muốn nhận phòng bên ngoài khung giờ quy định (ví dụ như sáng sớm hoặc tối muộn)? Bạn có thể thoả thuận trực tiếp với nơi lưu trú!
Vị trí
Lưu trú tại Ho Tram Pristine Beach là một lựa chọn đúng đắn khi quý khách đến thăm Phước Thuận.","[('Bãi biển Hồ Tràm', '802 m'), ('Biển Hồ Cốc', '3.88 km'), ('Bãi biển Hồ Tràm', '802 m'), ('Bãi biển Long Hải', '24.00 km'), ('Dinh Cô', '24.08 km'), ('Sân golf Vũng Tàu', '37.79 km')]"
Vũng Tàu,Tomorrow Hostel Vung Tau,"['https://ik.imagekit.io/tvlk/apr-asset/dgXfoyh24ryQLRcGq00cIdKHRmotrWLNlvG-TxlcLxGkiDwaUSggleJNPRgIHCX6/hotel/asset/20051137-b410b6118382694d8c8323380535b256.jpeg?_src=imagekit&tr=c-at_max,h-488,q-40,w-768', 'https://ik.imagekit.io/tvlk/apr-asset/dgXfoyh24ryQLRcGq00cIdKHRmotrWLNlvG-TxlcLxGkiDwaUSggleJNPRgIHCX6/hotel/asset/20051137-fd8334f1c191a2ace5ed44886ea10336.jpeg?_src=imagekit&tr=h-116,q-40,w-152', 'https://ik.imagekit.io/tvlk/apr-asset/dgXfoyh24ryQLRcGq00cIdKHRmotrWLNlvG-TxlcLxGkiDwaUSggleJNPRgIHCX6/hotel/asset/20051137-6c609ae2e697220ded09ab52dac09e5b.jpeg?_src=imagekit&tr=h-116,q-40,w-152', 'https://ik.imagekit.io/tvlk/apr-asset/dgXfoyh24ryQLRcGq00cIdKHRmotrWLNlvG-TxlcLxGkiDwaUSggleJNPRgIHCX6/hotel/asset/20051137-6b1b40f8841b235cbae698be910f470f.jpeg?_src=imagekit&tr=h-116,q-40,w-152', 'https://ik.imagekit.io/tvlk/apr-asset/dgXfoyh24ryQLRcGq00cIdKHRmotrWLNlvG-TxlcLxGkiDwaUSggleJNPRgIHCX6/hotel/asset/20051137-62c0c310599aaf871d5c687463762319.jpeg?_src=imagekit&tr=h-116,q-40,w-152']","https://www.traveloka.com/vi-vn/hotel/vietnam/tomorrow-hostel-vung-tau-4000001038406?spec=16-07-2022.17-07-2022.1.1.HOTEL.4000001038406.Tomorrow%20Hostel%20Vung%20Tau.1&prevSearchId=1736845221741755406&loginPromo=1&contexts=%7B%22inventoryRateKey%22%3A%22povEwB3ZzsU2C6pd%2B6MdU13LUNuufACdbU0usK5vg0dM0tKsNUio4Rxug1zOzHJilcvZa8YdqqIySdppe7dolTIewZlxfjiOGz6oXLTucMvN0%2BgQ3yZPvZcoHwUFNN%2BZpcr%2F%2FNa8o9ElfN8zOYhzzZeg0X586laFpeUViPi9rxBEr3qXB9sWMK3%2BaDI10NAOmhLDdV0WLeT%2FFKfQ0QL8LH02Dvlx%2F8PjYogEE5yzx6g6yOKyKeIDf7jO3GM45O1ok5sYzsZdVhL8yLD1ILOp6Q%3D%3D%22%7D
","92 Nguyễn Trường Tộ, Phường 3, Thành phố Vũng Tàu, Bà Rịa - Vũng Tàu, Việt Nam, 700000",1,280.000  VND,0,8,"['Phòng sạch sẽ, tuy nhiên giường hơi cọt kẹt, nếu di chuyển hoặc lăn qua lăn lại sẽ gây tiếng động làm ảnh hưởng đến người nằm trên hoặc dưới.', 'Sạch sẽ, anh chủ nhiệt tình giúp đỡ khách.', 'Mặc dù là phòng ký túc xá, nhưng thiết kế giường thực sự rất thoải mái và riêng tư', 'Tôi ở 2 đêm trong 6 ký túc xá trộn với phòng tắm bên trong. Chiếc giường lớn nhưng tối thiểu rèm không đủ che. Các địa điểm gần thực phẩm halal, Việt An, và gian hàng tráng miệng. Tôi thuê xe đạp leo núi 100.000 đồng.']","['Lễ tân 24h', 'WiFi']","Giờ nhận và trả phòng
Giờ nhận phòng: Từ 14:00
Giờ trả phòng: Trước 12:00
Vị trí
Lưu trú tại Tomorrow Hostel Vung Tau là một lựa chọn đúng đắn khi quý khách đến thăm Phường 3.
nơi nghỉ sở hữu vị trí đắc địa cách sân bay Sân bay Vũng Tàu 3,88 km.","[('Chợ Xóm Lưới', '491 m'), ('Sân bay Vũng Tàu', '3.88 km'), ('Bãi Sau', '1.81 km'), ('Sân golf Vũng Tàu', '3.85 km'), ('Dinh Cô', '17.50 km'), ('Bãi biển Long Hải', '17.62 km')]"
