City,Hotel name,Image,Url,Address,Stars,Min Price,Rating,Number of reviews,Reviews,Facilities,Description,Nearby places
Vũng Tàu,Diamond Sea Hotel Vung Tau,"['https://ik.imagekit.io/tvlk/apr-asset/dgXfoyh24ryQLRcGq00cIdKHRmotrWLNlvG-TxlcLxGkiDwaUSggleJNPRgIHCX6/hotel/asset/10035005-1ab2e7d8db13bc0d5ccf03a8c767a115.jpeg?_src=imagekit&tr=c-at_max,h-488,q-40,w-768', 'https://ik.imagekit.io/tvlk/apr-asset/dgXfoyh24ryQLRcGq00cIdKHRmotrWLNlvG-TxlcLxGkiDwaUSggleJNPRgIHCX6/hotel/asset/10035005-ece2d4fb2b7ca18723f4566cdda1c516.jpeg?_src=imagekit&tr=h-116,q-40,w-152', 'https://ik.imagekit.io/tvlk/apr-asset/dgXfoyh24ryQLRcGq00cIdKHRmotrWLNlvG-TxlcLxGkiDwaUSggleJNPRgIHCX6/hotel/asset/10035005-638x959-FIT_AND_TRIM-78411327ef384860e06502c36068ea89.jpeg?_src=imagekit&tr=h-116,q-40,w-152', 'https://ik.imagekit.io/tvlk/apr-asset/dgXfoyh24ryQLRcGq00cIdKHRmotrWLNlvG-TxlcLxGkiDwaUSggleJNPRgIHCX6/hotel/asset/10035005-2c7854b43f3b7da9b2ed933ddb6fd430.jpeg?_src=imagekit&tr=h-116,q-40,w-152', 'https://ik.imagekit.io/tvlk/apr-asset/dgXfoyh24ryQLRcGq00cIdKHRmotrWLNlvG-TxlcLxGkiDwaUSggleJNPRgIHCX6/hotel/asset/10035005-7ef1ecb6b35d1fd099e98f7a7ef37e43.jpeg?_src=imagekit&tr=h-116,q-40,w-152']","https://www.traveloka.com/vi-vn/hotel/vietnam/diamond-sea-hotel-vung-tau-3000010035005?spec=16-07-2022.17-07-2022.1.1.HOTEL.3000010035005.Diamond%20Sea%20Hotel%20Vung%20Tau.1&prevSearchId=1736844440384852440&loginPromo=1&contexts=%7B%22inventoryRateKey%22%3A%22povEwB3ZzsU2C6pd%2B6MdU13LUNuufACdbU0usK5vg0dM0tKsNUio4Rxug1zOzHJilcvZa8YdqqIySdppe7dolTIewZlxfjiOGz6oXLTucMvN0%2BgQ3yZPvZcoHwUFNN%2BZpcr%2F%2FNa8o9ElfN8zOYhzzZeg0X586laFpeUViPi9rxBAyIdJQt6VYGcPcbW8WnRPIvEWeildVo7nbHxIWcXPVNGysXwP9P%2F6jQTjnyKeTv%2ByqYmxSenRKFEfSHS0XO3ksOocFaHL1Wb9vQXntcm%2BDw%3D%3D%22%7D
","21 La Văn Cầu, Phường Thắng Tam, Thắng Tam, Thành phố Vũng Tàu, Bà Rịa - Vũng Tàu, Việt Nam, 793918",2,1.058.823  VND,8.6,314,"['Phòng thì ok sạch sẽ, nhân viên nhiệt tình chu đâo. Nhưng nên kiểm tra máy lạnh định kỳ, mình vào ở máy lạnh không có hơi lạnh rất nóng', 'Phòng rẻ, đẹp, sạch sẽ, gần biển. Đi bộ vài bước chân ra tới bãi tắm luôn. Rất ưng khách sạn. Lần sau có dịp sẽ ghé lại', 'các bạn đi lưu ý không làm dơ ga giường của khách sạn nếu không sẽ bị phụ thu 50k. Trong khj lúc nhận phòng ga giường cát không thì chã ai dám nói khách sạn. lần nào tới cũng ở đây. nhưng hoy koi như xui lần cuối ở', 'Khách sạn rất sạch và mới, tất cả nhân viên rất dễ thương, nói năng nhỏ nhẹ. Toilet của phòng gia đình siêu to và sạch. Giá cả lại phù hợp mà ở ngay trung tâm. Circle Không 2 bên khách sạn luôn. Xung quanh bán rất nhiều đồ ăn', 'Bố trí hợp lý, sạch sẽ, đầy đủ thiết bị', 'Phòng sạch sẽ. Thoáng mát. Nhân viên rất nhiệt tình, thân thiện. Vị trí rất thuận lợi. Đi ra biển, các điểm ăn uống, vui chơi gần. Lúc về mình để quên điện thoại. Bên kháchsạn đã giữ báo mình quay lại lấy. Cám ơn mọi người rất nhiều. Sẽ quay lại vào dịp gần nhất.', 'Phòng sạch sẽ tiện nghi,có dịch vụ thuê xe máy rất ok ạh,sẽ tiếp tục ủng hộ😊', 'máy lạnh không lạnh mặc dù để ở chế độ 18°C và vòi nước ở bồn rửa mặt chạy chậm', 'Sạch sẽ tiện nghi . Sẽ quay lại', 'Khách sạn sạch sẽ,có cửa sáng sủa,có nhiều hàng quán xung quanh,gần bãi tắm  nhưng thiếu bàn trang điểm.']","['Máy lạnh', 'Lễ tân 24h', 'Chỗ đậu xe', 'Thang máy', 'WiFi']","Giờ nhận và trả phòng
Giờ nhận phòng: Từ 14:00
Giờ trả phòng: Trước 12:00
Vị trí
Lưu trú tại Diamond Sea Hotel Vung Tau là một lựa chọn đúng đắn khi quý khách đến thăm Thắng Tam.
khách sạn này rất dễ tìm bởi vị trí đắc địa, nằm gần với nhiều tiện ích công cộng.","[('Linh Sơn Cổ Tự', '722 m'), ('Sân bay Vũng Tàu', '4.34 km'), ('Bãi Sau', '780 m'), ('Sân golf Vũng Tàu', '3.58 km'), ('Dinh Cô', '16.63 km'), ('Bãi biển Long Hải', '16.74 km')]"
Vũng Tàu,Khách sạn Jupiter Vũng Tàu,"['https://ik.imagekit.io/tvlk/apr-asset/dgXfoyh24ryQLRcGq00cIdKHRmotrWLNlvG-TxlcLxGkiDwaUSggleJNPRgIHCX6/hotel/asset/67751775-1175x1701-FIT_AND_TRIM-b3b184ef16ecb70b6d837f472a534919.jpeg?_src=imagekit&tr=c-at_max,h-488,q-40,w-768', 'https://ik.imagekit.io/tvlk/apr-asset/dgXfoyh24ryQLRcGq00cIdKHRmotrWLNlvG-TxlcLxGkiDwaUSggleJNPRgIHCX6/hotel/asset/67751775-1732x1154-FIT_AND_TRIM-2c551989e2dff3d3f9f47c33325f862e.jpeg?_src=imagekit&tr=h-116,q-40,w-152', 'https://ik.imagekit.io/tvlk/apr-asset/dgXfoyh24ryQLRcGq00cIdKHRmotrWLNlvG-TxlcLxGkiDwaUSggleJNPRgIHCX6/hotel/asset/67751775-1907x1048-FIT_AND_TRIM-02a2bc15e75c1d91523c477504bd33b7.jpeg?_src=imagekit&tr=h-116,q-40,w-152', 'https://ik.imagekit.io/tvlk/apr-asset/dgXfoyh24ryQLRcGq00cIdKHRmotrWLNlvG-TxlcLxGkiDwaUSggleJNPRgIHCX6/hotel/asset/67751775-1732x1154-FIT_AND_TRIM-13c3c9715737c959f47dbe72e05eaaf9.jpeg?_src=imagekit&tr=h-116,q-40,w-152', 'https://ik.imagekit.io/tvlk/apr-asset/dgXfoyh24ryQLRcGq00cIdKHRmotrWLNlvG-TxlcLxGkiDwaUSggleJNPRgIHCX6/hotel/asset/67751775-1732x1154-FIT_AND_TRIM-f5972059465c6fe6672dbe93813cf99a.jpeg?_src=imagekit&tr=h-116,q-40,w-152']","https://www.traveloka.com/vi-vn/hotel/vietnam/jupiter-hotel-vung-tau-3000020020411?spec=16-07-2022.17-07-2022.1.1.HOTEL.3000020020411.Kh%C3%A1ch%20s%E1%BA%A1n%20Jupiter%20V%C5%A9ng%20T%C3%A0u.1&prevSearchId=1736844440384852440&loginPromo=1&contexts=%7B%22inventoryRateKey%22%3A%22povEwB3ZzsU2C6pd%2B6MdU13LUNuufACdbU0usK5vg0dM0tKsNUio4Rxug1zOzHJilcvZa8YdqqIySdppe7dolTIewZlxfjiOGz6oXLTucMvN0%2BgQ3yZPvZcoHwUFNN%2BZpcr%2F%2FNa8o9ElfN8zOYhzzZeg0X586laFpeUViPi9rxA%2FlWIatAKir3OMMQS6gj2tmhLDdV0WLeT%2FFKfQ0QL8LH02Dvlx%2F8PjYogEE5yzx6g6yOKyKeIDf7jO3GM45O1ok5sYzsZdVhL8yLD1ILOp6Q%3D%3D%22%7D
","257/1 Lê Hồng Phong, Phường 8, Thành phố Vũng Tàu, Bà Rịa - Vũng Tàu, Việt Nam, 790000",1,750.000  VND,8.4,54,"['Tôi đã có một đêm nghỉ tại đây khá tốt. Phòng sạch sẽ nhưng cách bố trí chưa được hợp lí và tiện nghi lắm.', 'Phòng sạch sẽ, nhận phòng trả phòng nhanh chóng ạ. Anh chủ vui vẻ thân thiện. Chỗ để xe rộng rãi', 'Khách sạn quá là OK, giá cả hợp túi tiền, lễ tân cũng rất là Nhiệt Tình, Dễ Tính với Chu Đáo nữa. Nói chung chung là ổn áp. Nhất định có dịp đi chơi là sẽ ghé nữa 😘 À mà mình đi 2 người, hôm trả phòng check out trễ tận 1 tiếng rưỡi, lễ tân vui vẻ Free cho mình luôn kkk.', 'Nhân viên khách sạn thân thiện, tuy nhiên chất lượng phòng không tương xứng với giá tiền. Nhà vệ sinh đọng nước...Tôi đánh giá 4 sao.', 'Bác bảo vệ vui tính, sạch sẽ thoáng mát.', 'Phòng rộng rãi, sạch sẽ, anh chủ thân thiện, cho nhận phòng lúc 12g. Có cái phòng hơi ít móc treo đồ với mình. Nhưng bỏ qua được. Sẽ quay lại nếu có dịp ghé VũngTàu', 'Rất tuyệt phòng sạch sẽ, ông chủ tốt bụng, bác bảo vệ thân thiện!', 'Phòng giống như trong hình. Lễ tân lịch sự vui vẻ, mình rất hài lòng.', 'Phòng mới sạch sẽ, mọi người thân thiện nói chung tạm ổn không có gì phàn nàn. Thanks', 'Chất lượng dịch vụ khá tốt. Anh lễ tân vui vẻ, nhiệt tình. Phòng hơi nhỏ so với kì vọng, nhưng thoải mái và sạch sẽ.']","['Máy lạnh', 'Nhà hàng', 'Chỗ đậu xe', 'Thang máy', 'WiFi']","Giờ nhận và trả phòng
Giờ nhận phòng: 14:00 - 22:00
Giờ trả phòng: 07:00 - 12:00
Bạn muốn nhận phòng bên ngoài khung giờ quy định (ví dụ như sáng sớm hoặc tối muộn)? Bạn có thể thoả thuận trực tiếp với nơi lưu trú!
Vị trí
Jupiter Hotel Vung Tau là một khách sạn nằm trong khu vực an ninh, toạ lạc tại Phường 8.","[('Lotte Mart Vung Tau', '145 m'), ('Sân bay Vũng Tàu', '2.98 km'), ('Bãi Sau', '2.16 km'), ('Sân golf Vũng Tàu', '2.36 km'), ('Dinh Cô', '15.98 km'), ('Bãi biển Long Hải', '16.11 km')]"
Vũng Tàu,Khách sạn Kim Ngân II,"['https://ik.imagekit.io/tvlk/apr-asset/Ixf4aptF5N2Qdfmh4fGGYhTN274kJXuNMkUAzpL5HuD9jzSxIGG5kZNhhHY-p7nw/hotel/asset/67807981-1584504d4e0ee71ea00efde87ed6daca.jpeg?_src=imagekit&tr=c-at_max,h-488,q-40,w-768', 'https://ik.imagekit.io/tvlk/apr-asset/Ixf4aptF5N2Qdfmh4fGGYhTN274kJXuNMkUAzpL5HuD9jzSxIGG5kZNhhHY-p7nw/hotel/asset/67807981-b2467972385fd27dcdea8707092d3c24.jpeg?_src=imagekit&tr=h-116,q-40,w-152', 'https://ik.imagekit.io/tvlk/apr-asset/Ixf4aptF5N2Qdfmh4fGGYhTN274kJXuNMkUAzpL5HuD9jzSxIGG5kZNhhHY-p7nw/hotel/asset/67807981-bc7be045d663343dd06197306907ea4e.jpeg?_src=imagekit&tr=h-116,q-40,w-152', 'https://ik.imagekit.io/tvlk/apr-asset/Ixf4aptF5N2Qdfmh4fGGYhTN274kJXuNMkUAzpL5HuD9jzSxIGG5kZNhhHY-p7nw/hotel/asset/67807981-ddbf3bcc100741cde47f257e06566a4e.jpeg?_src=imagekit&tr=h-116,q-40,w-152', 'https://ik.imagekit.io/tvlk/apr-asset/Ixf4aptF5N2Qdfmh4fGGYhTN274kJXuNMkUAzpL5HuD9jzSxIGG5kZNhhHY-p7nw/hotel/asset/67807981-33952131de80b338c6c57b1c05e06949.jpeg?_src=imagekit&tr=h-116,q-40,w-152']","https://www.traveloka.com/vi-vn/hotel/vietnam/kim-ngan-ii-hotel-9000000971412?spec=16-07-2022.17-07-2022.1.1.HOTEL.9000000971412.Kh%C3%A1ch%20s%E1%BA%A1n%20Kim%20Ng%C3%A2n%20II.1&prevSearchId=1736844440384852440&loginPromo=1&contexts=%7B%22inventoryRateKey%22%3A%22povEwB3ZzsU2C6pd%2B6MdU13LUNuufACdbU0usK5vg0dM0tKsNUio4Rxug1zOzHJilcvZa8YdqqIySdppe7dolTIewZlxfjiOGz6oXLTucMvN0%2BgQ3yZPvZcoHwUFNN%2BZpcr%2F%2FNa8o9ElfN8zOYhzzZeg0X586laFpeUViPi9rxAxsMOqZ%2FFtIWEJV9TGyy%2F2mhLDdV0WLeT%2FFKfQ0QL8LH02Dvlx%2F8PjYogEE5yzx6g6yOKyKeIDf7jO3GM45O1ok5sYzsZdVhL8yLD1ILOp6Q%3D%3D%22%7D
","số 30 đường Võ Thị Sáu, khu 7, Côn Đảo (Hòn Sơn), Bà Rịa - Vũng Tàu, Việt Nam, 78800",1,600.000  VND,9.0,13,"['Dịch vụ tốt, nhân viên thân thiện ❤️', 'Khách sạn có vị trí đẹp,ngay trung tâm,ra nghĩa trang Hàng Dương gần,gần khu ăn uống,chủ khách sạn dễ thương,tận tình,kem dừa dưới quán ngon,ngày ăn nhẹ 4 cữ kem', 'Phòng rộng rãi, sạch sẽ, thoáng mát. Địa điểm đi lại thuận lợi.', 'Mình xin review chân thật chuyến đi ngày 24-26/4 vừa rồi: -Về phòng: Nên chọn phòng lớn có ban công và ở trên tầng 2 trở lên để tránh muỗi. -Về khuôn viên: Kháchsạn có luôn kem dừa Côn Đảo ăn rất ngon. Đi cỡ tháng 5 là 2 cây nhãn của khách sạn cũng chín tha hồ hái quả -Về nhân viên: Nhiệt tình hỗ trợ khách mọi nhu cầu, khách quên đồ sẵn sàng gửi CPN ra giúp. -Về vị trí: kháchsạn ở trung tâm, đi đâu cũng tiện ăn uống. Đi lễ không quá xa -Về giá: quá là hợp lý nếu nhu cầu chỉ là đi lễ -Về tiện nghi: vừa phải nhưng sạch sẽ.']","['Máy lạnh', 'Nhà hàng', 'Thang máy', 'WiFi']","Giờ nhận và trả phòng
Giờ nhận phòng: 14:00 - 22:00
Giờ trả phòng: 05:00 - 12:00
Bạn muốn nhận phòng bên ngoài khung giờ quy định (ví dụ như sáng sớm hoặc tối muộn)? Bạn có thể thoả thuận trực tiếp với nơi lưu trú!
Vị trí
Kim Ngan II Hotel toạ lạc tại khu vực / thành phố Côn Đảo (Hòn Sơn).","[('Trại giam Phú Hải', '414 m'), ('Sân bay Côn Đảo (VCS)', '5.56 km'), ('Trại giam Phú Hải', '414 m'), ('Vườn quốc gia Côn Đảo', '1.87 km'), ('Bãi biển Đất Dốc', '2.70 km'), ('Sân bay Côn Đảo (VCS)', '5.56 km')]"
Vũng Tàu,Hoang Linh Hotel,"['https://ik.imagekit.io/tvlk/apr-asset/dgXfoyh24ryQLRcGq00cIdKHRmotrWLNlvG-TxlcLxGkiDwaUSggleJNPRgIHCX6/hotel/asset/10036941-1000x666-FIT_AND_TRIM-1587e1f5195327504c3a3cdd0bcad146.jpeg?_src=imagekit&tr=c-at_max,h-488,q-40,w-768', 'https://ik.imagekit.io/tvlk/apr-asset/dgXfoyh24ryQLRcGq00cIdKHRmotrWLNlvG-TxlcLxGkiDwaUSggleJNPRgIHCX6/hotel/asset/10036941-2935x1650-FIT_AND_TRIM-5719443f1e9da8622735dbc9b2ab0f61.jpeg?_src=imagekit&tr=h-116,q-40,w-152', 'https://ik.imagekit.io/tvlk/apr-asset/dgXfoyh24ryQLRcGq00cIdKHRmotrWLNlvG-TxlcLxGkiDwaUSggleJNPRgIHCX6/hotel/asset/10036941-1500x1000-FIT_AND_TRIM-15ea92834129d578fe19469b05994e4c.jpeg?_src=imagekit&tr=h-116,q-40,w-152', 'https://ik.imagekit.io/tvlk/apr-asset/dgXfoyh24ryQLRcGq00cIdKHRmotrWLNlvG-TxlcLxGkiDwaUSggleJNPRgIHCX6/hotel/asset/10036941-2500x1666-FIT_AND_TRIM-5437cb19a6eefdb0d51aded4e60261b2.jpeg?_src=imagekit&tr=h-116,q-40,w-152', 'https://ik.imagekit.io/tvlk/apr-asset/dgXfoyh24ryQLRcGq00cIdKHRmotrWLNlvG-TxlcLxGkiDwaUSggleJNPRgIHCX6/hotel/asset/10036941-1600x1066-FIT_AND_TRIM-2d6fef50843f15123b19a4c9259d6b96.jpeg?_src=imagekit&tr=h-116,q-40,w-152']","https://www.traveloka.com/vi-vn/hotel/vietnam/hoang-linh-hotel-3000010036941?spec=16-07-2022.17-07-2022.1.1.HOTEL.3000010036941.Hoang%20Linh%20Hotel.1&prevSearchId=1736844440384852440&loginPromo=1&contexts=%7B%22inventoryRateKey%22%3A%22povEwB3ZzsU2C6pd%2B6MdU13LUNuufACdbU0usK5vg0dM0tKsNUio4Rxug1zOzHJilcvZa8YdqqIySdppe7dolTIewZlxfjiOGz6oXLTucMvN0%2BgQ3yZPvZcoHwUFNN%2BZpcr%2F%2FNa8o9ElfN8zOYhzzZeg0X586laFpeUViPi9rxBmwvZ2YEfP4nhoiDGlUr32mhLDdV0WLeT%2FFKfQ0QL8LH02Dvlx%2F8PjYogEE5yzx6g6yOKyKeIDf7jO3GM45O1ok5sYzsZdVhL8yLD1ILOp6Q%3D%3D%22%7D
","45/32 Thùy Vân, Phường 2, Thành phố Vũng Tàu, Bà Rịa - Vũng Tàu, Việt Nam, 791018",2,900.000  VND,8.1,154,"['Nhà nghỉ sạch sẽ, chị chủ nhà nhiệt tình', 'Cô chủ siu đáng iu mọi người ạ ❤️ Lần sau tới nhất định book lun. Giá phải chăng ra biển chỉ 2p i bộ có khi không tới nữaa. Khuyên mọi người nên book nhé', 'Khách sạn sạch sẽ, cô chủ tận tình. Có dịp sẽ quay lại', 'Cô chủ dễ thương xỉu :) nhiệt tình', 'Nói chung là phòng ok, phù hợp giá tiền, gần biển, cũng khá sạch. Bà chủ rất dễ thương nhiệt tình', 'khách sạn sạch sẽ mát mẻ, chủ khách sạn dễ tính', 'Cô chủ nhiệt tình dễ thương luôn mng ơi. Phòng sạch sẽ. Phòng bọn mình tầng 5 yên tĩnh , nhìn thẳng ra biển luôn', 'Khách sạn sạch sẽ cô chủ dễ tính nói chung OK nên ở nha mọi người.', 'Mình thấy khá hài lòng, chị Chủ rất dễ thương nhá, khách muốn đi đâu ăn gì đều được chỉ rõ tận tình, phòng thì rất oki, cực ấm cúng. Thích nhất là giá phòng sao nói thế ngay từ đầu không nói thách, cảm thấy như nhà của mình. Có dịp sẽ đặt phòng bên Hoang Linh nữa', 'Chủ nhà thân thiện nhiệt tình']","['Lễ tân 24h', 'Thang máy', 'WiFi']","Giờ nhận và trả phòng
Giờ nhận phòng: Từ 14:00
Giờ trả phòng: Trước 12:00
Vị trí
Hoang Linh Hotel toạ lạc tại khu vực / thành phố Phường 2.
khách sạn sở hữu vị trí đắc địa cách sân bay Sân bay Vũng Tàu 5,13 km.","[('Bãi Sau', '77 m'), ('Sân bay Vũng Tàu', '5.13 km'), ('Bãi Sau', '77 m'), ('Sân golf Vũng Tàu', '4.32 km'), ('Dinh Cô', '17.06 km'), ('Bãi biển Long Hải', '17.16 km')]"
Vũng Tàu,Artmio Hotel Apartment & Coffee,"['https://ik.imagekit.io/tvlk/apr-asset/dgXfoyh24ryQLRcGq00cIdKHRmotrWLNlvG-TxlcLxGkiDwaUSggleJNPRgIHCX6/hotel/asset/67783369-e329fd61fa74e304426b7abf26fe0f2e.jpeg?_src=imagekit&tr=c-at_max,h-488,q-40,w-768', 'https://ik.imagekit.io/tvlk/apr-asset/dgXfoyh24ryQLRcGq00cIdKHRmotrWLNlvG-TxlcLxGkiDwaUSggleJNPRgIHCX6/hotel/asset/67783369-108019fbbde1bca0786373fa2a06769c.jpeg?_src=imagekit&tr=h-116,q-40,w-152', 'https://ik.imagekit.io/tvlk/apr-asset/dgXfoyh24ryQLRcGq00cIdKHRmotrWLNlvG-TxlcLxGkiDwaUSggleJNPRgIHCX6/hotel/asset/67783369-fa9b007bdc7204627aae6e9d045e27fe.jpeg?_src=imagekit&tr=h-116,q-40,w-152', 'https://ik.imagekit.io/tvlk/apr-asset/dgXfoyh24ryQLRcGq00cIdKHRmotrWLNlvG-TxlcLxGkiDwaUSggleJNPRgIHCX6/hotel/asset/67783369-178650ea4d532d588c11cc79091e01a8.jpeg?_src=imagekit&tr=h-116,q-40,w-152', 'https://ik.imagekit.io/tvlk/apr-asset/dgXfoyh24ryQLRcGq00cIdKHRmotrWLNlvG-TxlcLxGkiDwaUSggleJNPRgIHCX6/hotel/asset/67783369-786a3f560aca0c49b8b3bc23e7687ab7.jpeg?_src=imagekit&tr=h-116,q-40,w-152']","https://www.traveloka.com/vi-vn/hotel/vietnam/artmio-hotel-apartment--coffee-9000000732598?spec=16-07-2022.17-07-2022.1.1.HOTEL.9000000732598.Artmio%20Hotel%20Apartment%20%26%20Coffee.1&prevSearchId=1736844440384852440&loginPromo=1&contexts=%7B%22inventoryRateKey%22%3A%22povEwB3ZzsU2C6pd%2B6MdU13LUNuufACdbU0usK5vg0dM0tKsNUio4Rxug1zOzHJilcvZa8YdqqIySdppe7dolTIewZlxfjiOGz6oXLTucMvN0%2BgQ3yZPvZcoHwUFNN%2BZpcr%2F%2FNa8o9ElfN8zOYhzzZeg0X586laFpeUViPi9rxDO1ZBCYadkgPT444z3q4hpIvEWeildVo7nbHxIWcXPVNGysXwP9P%2F6jQTjnyKeTv%2ByqYmxSenRKFEfSHS0XO3ksOocFaHL1Wb9vQXntcm%2BDw%3D%3D%22%7D
","11 Lê Văn Tám, Phường 1, Thành phố Vũng Tàu, Bà Rịa - Vũng Tàu, Việt Nam, 78206",0,1.218.000  VND,8.9,36,"['Phòng đầy đủ tiện nghi, sạch sẽ, tiện đi lại, gần biển. Tuyệt vời', 'Khách sạn khá là chuyên nghiệp, ở dưới là là quán cf Acoustic, mình tới sớm 1t và ngồi chờ trong quán, được các bạn nhânviên phục vụ nước và bánh miễn phí, view quán cf theo style vintage, tông màu trầm ấm cúng. Phòng kháchsạn và tiện nghi đầy đủ, có bếp điện, tủ lạnh mini, máy giặt, không có gì phải chê Bạn tiếp tân cực kỳ dễ thương, cả trên FB và trực tiếp đều hướng dẫn tận tình', 'Phục vụ tốt, nhân viên thân thiện', 'Mọi thứ đều rất OK,vị trí trung tâm nên dễ đi chuyển để ăn uống', 'Mình book được khách sạn này với giá vô cùng hợp lý. Tầng 1 là coffee . Hình như buổi tối có acoustic. Sảnh trang trí khá bắt mắt. Trong lúc ngồi chờ thì khách sạn còn mời nước và bánh flan khá là ngon luôn. Mình đến sớm và được bạn lễ tân cho check in sớm lun. Chỗ để xe khá rộng và thoải mái. Phòng cũng rộng và đầy đủ tiện nghi. Sạch sẽ và thoáng mát. Có view nhìn ra thành phố. Vị trí ngay trung tâm.', 'các bạn nhân viên nhiệt tình không gian ổn', 'Phòng dạng studio nhìn rất thân thiện, đầy đủ tiện nghi, sạch sẽ và hiện đại. Nhân viên lịch sự, nhiệt tình. Đặc biệt có quán cà phê ngay tầng 1 giá ổn, coffee ngon, đa dạng đồ uống đẳng cấp, không gian quán như phòng trà, nhìn ấm cúng. Đặc biệt thứ 7, chủ nhật sáng tối có chơi nhạc, ban nhạc xịn sò, khách đông. Rất đáng trải nghiệm, giá phòng quá ổn so với chất lượng :).', 'Dịch vụ tốt, nhân viên thân thiện. Vì vậy, tôi thích tầm nhìn của bạn từ ban công. Tuy nhiên, tôi nghĩ trong mỗi phòng nên có một chiếc gương vì nó không có bất kỳ đồ vật nào để soi bản thân hay thậm chí là selfie. Cảm ơn rất nhiều. Yêu yah.', 'Căn hộ dễ thương và tiện lợi với nội thất và thiết bị nhà bếp. Nhân viên tốt và dịch vụ tuyệt vời. Có một quán cà phê thư giãn với nhạc cụ ở tầng trệt. Tôi đã được phục vụ FnB khi chờ làm thủ tục.', 'Phòng khá tốt, tất cả đồ đạc còn mới và còn nguyên mùi gỗ. Quán cà phê ở tầng dưới có tầm nhìn tuyệt vời, trang trí và ban nhạc sống. Tôi ở đây 1 đêm, thưởng thức cà phê 2 lần và rất vui khi được bạn bè giới thiệu. Cô gái lễ tân siêu thông minh, hữu ích và thân thiện ^^']","['Máy lạnh', 'Nhà hàng', 'Chỗ đậu xe', 'Thang máy', 'WiFi']","Giờ nhận và trả phòng
Giờ nhận phòng: 14:00 - 21:00
Giờ trả phòng: 07:00 - 12:00
Bạn muốn nhận phòng bên ngoài khung giờ quy định (ví dụ như sáng sớm hoặc tối muộn)? Bạn có thể thoả thuận trực tiếp với nơi lưu trú!
Vị trí
Artmio Hotel Apartment & Coffee là một nơi nghỉ nằm trong khu vực an ninh, toạ lạc tại Phường 1.","[('Lam Son Square', '215 m'), ('Sân bay Vũng Tàu', '3.59 km'), ('Bãi Sau', '2.47 km'), ('Sân golf Vũng Tàu', '3.95 km'), ('Dinh Cô', '17.78 km'), ('Bãi biển Long Hải', '17.91 km')]"
Vũng Tàu,Khách sạn Royal Vũng Tàu,"['https://ik.imagekit.io/tvlk/apr-asset/dgXfoyh24ryQLRcGq00cIdKHRmotrWLNlvG-TxlcLxGkiDwaUSggleJNPRgIHCX6/hotel/asset/10026391-1000x666-FIT_AND_TRIM-1a7ca3f25d74c65c42cf9c3360f0f873.jpeg?_src=imagekit&tr=c-at_max,h-488,q-40,w-768', 'https://ik.imagekit.io/tvlk/apr-asset/dgXfoyh24ryQLRcGq00cIdKHRmotrWLNlvG-TxlcLxGkiDwaUSggleJNPRgIHCX6/hotel/asset/10026391-30afb93a9f38fee81e8a4101d6e2658c.jpeg?_src=imagekit&tr=h-116,q-40,w-152', 'https://ik.imagekit.io/tvlk/apr-asset/dgXfoyh24ryQLRcGq00cIdKHRmotrWLNlvG-TxlcLxGkiDwaUSggleJNPRgIHCX6/hotel/asset/10026391-e61e3eb0469269ac0218055f3921a4f7.jpeg?_src=imagekit&tr=h-116,q-40,w-152', 'https://ik.imagekit.io/tvlk/apr-asset/dgXfoyh24ryQLRcGq00cIdKHRmotrWLNlvG-TxlcLxGkiDwaUSggleJNPRgIHCX6/hotel/asset/10026391-a81a4bff56b8a9fb60e4df3d9f51d0ea.jpeg?_src=imagekit&tr=h-116,q-40,w-152', 'https://ik.imagekit.io/tvlk/apr-asset/dgXfoyh24ryQLRcGq00cIdKHRmotrWLNlvG-TxlcLxGkiDwaUSggleJNPRgIHCX6/hotel/asset/10026391-1000x666-FIT_AND_TRIM-e3377a5c1dabb76983836f6ef71fc40b.jpeg?_src=imagekit&tr=h-116,q-40,w-152']","https://www.traveloka.com/vi-vn/hotel/vietnam/royal-hotel-vung-tau-1000000543702?spec=16-07-2022.17-07-2022.1.1.HOTEL.1000000543702.Kh%C3%A1ch%20s%E1%BA%A1n%20Royal%20V%C5%A9ng%20T%C3%A0u.1&prevSearchId=1736844440384852440&loginPromo=1&contexts=%7B%22inventoryRateKey%22%3A%22povEwB3ZzsU2C6pd%2B6MdU13LUNuufACdbU0usK5vg0dM0tKsNUio4Rxug1zOzHJilcvZa8YdqqIySdppe7dolTIewZlxfjiOGz6oXLTucMvN0%2BgQ3yZPvZcoHwUFNN%2BZpcr%2F%2FNa8o9ElfN8zOYhzzZeg0X586laFpeUViPi9rxAMkF3nA%2BOz8quVND18eHffIvEWeildVo7nbHxIWcXPVNGysXwP9P%2F6jQTjnyKeTv%2ByqYmxSenRKFEfSHS0XO3ksOocFaHL1Wb9vQXntcm%2BDw%3D%3D%22%7D
","36 Quang Trung, Phường 1, Thành phố Vũng Tàu, Bà Rịa - Vũng Tàu, Việt Nam, 793618",3,1.265.000  VND,8.0,59,"['Không có ăn sáng + hồ bơi phải trả phí 80k/người + phải phụ thu thêm giường + nói chung trả khác gì ở nhà nghỉ thôi mà chi phí quá cao', 'Khách sạn mang phong cách rất xưa nhưng thiết kế cao cấp, nhân viên rất dễ thương và nhiệt tình. Mặc dù có 1 bạn phục vụ nhà hàng làm mình không thích lắm, nhìn mặt thấy luôn quạu, mình hỏi về đồ ăn vì có ý định xuống nhà hàng ăn nhưng bạn tỏ ra rất khó chịu và trả lời không có tâm nên mình ghét không ăn luôn ra ngoài ăn và sẽ cho đánh giá thấp. Nhưng bù lại có bác bảo vệ bãi xe phía sau làm việc và giao tiếp rất chuyên nghiệp nên cũng đỡ tức. Còn lại thì đáng đồng tiền, nếu bạn nào thích sống trong 1 không gian resort cao cấp phong cách bán cổ điển từ những năm 2000 thì có thể sẽ rất thích không gian nơi đây, giống như mình :))) Một điểm cộng là vị trí rất tốt, đối diện là bãi tắm nên có thể đi bộ ra được, trước có quán cà phê Kem ngon và rẻ, khu vực xung quanh sầm uất, rất vui về đêm. Mình đến đây lần đầu nhưng sau này có dịp sẽ quay lại.', 'Ban công không sạch sẽ; Hành lang và phòng ngủ quá nhiều muỗi', 'Khách sạn để có hồ bơi nhưng khi đến thì báo không có, dùng chung khách sạn kế bên. Máy lạnh không mát', 'hình chụp không đúng, khách sạn ngay bãi biển, rất gần. Nhưng không có hồ bơi như hình chụp, các bé hơi thất vọng. nhưng phòng cũng OK nhé.', 'Nhân viên nhiệt tình- Thân thiện. Nội thất khá cũ, hệ thống thoát nước yếu. 7/10', 'Nước tắm bẩn, có mùi và màu đục. Mình tắm xong về bị dị ứng nổi ngứa. Một trải nghiệm rất tệ', 'Rất tốt. Phòng sạch sẽ. Wifi hơi yếu cho những phòng nằm cuối. Phục vụ tốt.', 'Phòng ổn với mức giá. Sảnh rộng. Hơi buồn vì hồ bơi chưa mở', 'Phòng sạch sẽ thoải mái. Gần biển rất tiện đi lại']","['Máy lạnh', 'Nhà hàng', 'Lễ tân 24h', 'Chỗ đậu xe', 'WiFi']","Giờ nhận và trả phòng
Giờ nhận phòng: Từ 14:00
Giờ trả phòng: Trước 12:00
Vị trí
Royal Hotel Vung Tau là một khách sạn nằm trong khu vực an ninh, toạ lạc tại Phường 1.
Không chỉ sở hữu vị trí đắc địa, Royal Hotel Vung Tau còn là một trong những khách sạn nằm cách Lam Son Square chưa đầy 0,23 km và Worldwide Arms Museum chưa đầy 0,4 km.","[('Lam Son Square', '226 m'), ('Sân bay Vũng Tàu', '3.87 km'), ('Bãi Sau', '2.69 km'), ('Sân golf Vũng Tàu', '4.36 km'), ('Dinh Cô', '18.20 km'), ('Bãi biển Long Hải', '18.33 km')]"
