City,Hotel name,Image,Url,Address,Stars,Min Price,Rating,Number of reviews,Reviews,Facilities,Description,Nearby places
Vũng Tàu,Thinh Khang Hotel,"['https://ik.imagekit.io/tvlk/apr-asset/dgXfoyh24ryQLRcGq00cIdKHRmotrWLNlvG-TxlcLxGkiDwaUSggleJNPRgIHCX6/hotel/asset/10034725-9fb540a7d43919d2deeb89c131c7bf96.jpeg?_src=imagekit&tr=c-at_max,h-488,q-40,w-768', 'https://ik.imagekit.io/tvlk/apr-asset/dgXfoyh24ryQLRcGq00cIdKHRmotrWLNlvG-TxlcLxGkiDwaUSggleJNPRgIHCX6/hotel/asset/10034725-800x600-FIT_AND_TRIM-34fe43b4c215d94e8a991014b96e579c.jpeg?_src=imagekit&tr=h-116,q-40,w-152', 'https://ik.imagekit.io/tvlk/apr-asset/dgXfoyh24ryQLRcGq00cIdKHRmotrWLNlvG-TxlcLxGkiDwaUSggleJNPRgIHCX6/hotel/asset/10034725-800x600-FIT_AND_TRIM-e38ce322ebeea735b29fca9d8d3bc3b0.jpeg?_src=imagekit&tr=h-116,q-40,w-152', 'https://ik.imagekit.io/tvlk/apr-asset/dgXfoyh24ryQLRcGq00cIdKHRmotrWLNlvG-TxlcLxGkiDwaUSggleJNPRgIHCX6/hotel/asset/10034725-800x600-FIT_AND_TRIM-a316945e07efee7956a2b59309498da1.jpeg?_src=imagekit&tr=h-116,q-40,w-152', 'https://ik.imagekit.io/tvlk/apr-asset/dgXfoyh24ryQLRcGq00cIdKHRmotrWLNlvG-TxlcLxGkiDwaUSggleJNPRgIHCX6/hotel/asset/10034725-800x600-FIT_AND_TRIM-dfa3f61aa81609e9fe88f4063b3a15b6.jpeg?_src=imagekit&tr=h-116,q-40,w-152']","https://www.traveloka.com/vi-vn/hotel/vietnam/thinh-khang-hotel-3000010034725?spec=16-07-2022.17-07-2022.1.1.HOTEL.3000010034725.Thinh%20Khang%20Hotel.1&prevSearchId=1736844834469074900&loginPromo=1&contexts=%7B%22inventoryRateKey%22%3A%22povEwB3ZzsU2C6pd%2B6MdU13LUNuufACdbU0usK5vg0dM0tKsNUio4Rxug1zOzHJilcvZa8YdqqIySdppe7dolTIewZlxfjiOGz6oXLTucMvN0%2BgQ3yZPvZcoHwUFNN%2BZpcr%2F%2FNa8o9ElfN8zOYhzzZeg0X586laFpeUViPi9rxAxsMOqZ%2FFtIWEJV9TGyy%2F2mhLDdV0WLeT%2FFKfQ0QL8LH02Dvlx%2F8PjYogEE5yzx6g6yOKyKeIDf7jO3GM45O1ok5sYzsZdVhL8yLD1ILOp6Q%3D%3D%22%7D
","95 Nguyễn Thị Minh Khai, Phường 8, Thành phố Vũng Tàu, Bà Rịa - Vũng Tàu, Việt Nam, 791617",1,600.000  VND,8.2,17,"['Phòng sạch sẽ. Máy lạnh xài đx nhưng không chỉnh quạt quay được. Ổ điện quá ít. Toilet không có thùng rác. Mọi thứ ok', 'Tốt, sạch sẽ, chỉ hơi xa biển tí', 'Đường đi vô gồ ghề sỏi đá, ra biển phải đi bằng xe máy. Ngồi truoc khách sạn nghe mùi, khách sạn phòng nhỏ, trời tối không mở đèn hành lang, ở qua ngày không dọn phòng, không cho thêm khăn, quên cho dầu gội sữa tắm phải đi xin.']","['Máy lạnh', 'Lễ tân 24h', 'Chỗ đậu xe', 'Thang máy', 'WiFi']","Giờ nhận và trả phòng
Giờ nhận phòng: Từ 13:00
Giờ trả phòng: Trước 12:00
Vị trí
Thinh Khang Hotel là một khách sạn nằm trong khu vực an ninh, toạ lạc tại Phường 8.
Không chỉ sở hữu vị trí đắc địa, Thinh Khang Hotel còn là một trong những khách sạn nằm cách Lotte Mart Vung Tau chưa đầy 0,54 km và Sân golf Vũng Tàu chưa đầy 1,87 km.","[('Lotte Mart Vung Tau', '539 m'), ('Sân bay Vũng Tàu', '2.46 km'), ('Sân golf Vũng Tàu', '1.87 km'), ('Bãi Sau', '2.72 km'), ('Dinh Cô', '15.65 km'), ('Bãi biển Long Hải', '15.79 km')]"
Vũng Tàu,Minh Thang Hotel Con Dao,"['https://ik.imagekit.io/tvlk/apr-asset/dgXfoyh24ryQLRcGq00cIdKHRmotrWLNlvG-TxlcLxGkiDwaUSggleJNPRgIHCX6/hotel/asset/20024475-1f3d4e0480541cd4c2e275a6d7667ae3.jpeg?_src=imagekit&tr=c-at_max,h-488,q-40,w-768', 'https://ik.imagekit.io/tvlk/apr-asset/dgXfoyh24ryQLRcGq00cIdKHRmotrWLNlvG-TxlcLxGkiDwaUSggleJNPRgIHCX6/hotel/asset/20024475-0991d784da0839608f7e95cb31687d58.jpeg?_src=imagekit&tr=h-116,q-40,w-152', 'https://ik.imagekit.io/tvlk/apr-asset/dgXfoyh24ryQLRcGq00cIdKHRmotrWLNlvG-TxlcLxGkiDwaUSggleJNPRgIHCX6/hotel/asset/20024475-624f937919fa4fc7bd8c0ef5bfecf1f7.jpeg?_src=imagekit&tr=h-116,q-40,w-152', 'https://ik.imagekit.io/tvlk/apr-asset/dgXfoyh24ryQLRcGq00cIdKHRmotrWLNlvG-TxlcLxGkiDwaUSggleJNPRgIHCX6/hotel/asset/20024475-9fc0ff91e3f9dd0f76889c1cad0a52ed.jpeg?_src=imagekit&tr=h-116,q-40,w-152', 'https://ik.imagekit.io/tvlk/apr-asset/dgXfoyh24ryQLRcGq00cIdKHRmotrWLNlvG-TxlcLxGkiDwaUSggleJNPRgIHCX6/hotel/asset/20024475-3f085f53eb389b1249c427622a8873ff.jpeg?_src=imagekit&tr=h-116,q-40,w-152']","https://www.traveloka.com/vi-vn/hotel/vietnam/minh-thang-hotel-con-dao-9000000190704?spec=16-07-2022.17-07-2022.1.1.HOTEL.9000000190704.Minh%20Thang%20Hotel%20Con%20Dao.1&prevSearchId=1736844834469074900&loginPromo=1&contexts=%7B%22inventoryRateKey%22%3A%22povEwB3ZzsU2C6pd%2B6MdU13LUNuufACdbU0usK5vg0dM0tKsNUio4Rxug1zOzHJilcvZa8YdqqIySdppe7dolTIewZlxfjiOGz6oXLTucMvN0%2BgQ3yZPvZcoHwUFNN%2BZpcr%2F%2FNa8o9ElfN8zOYhzzZeg0X586laFpeUViPi9rxBFAhiqzLVEvmtEEolyDuqxmhLDdV0WLeT%2FFKfQ0QL8LH02Dvlx%2F8PjYogEE5yzx6g6yOKyKeIDf7jO3GM45O1ok5sYzsZdVhL8yLD1ILOp6Q%3D%3D%22%7D
","Khu 5, Đường Nguyễn Huệ, Côn Đảo (Hòn Sơn), Bà Rịa - Vũng Tàu, Việt Nam, 794302",2,486.000  VND,0,6,"['Mọi người đều rất nhiệt tình và vui vẻ. Phòng ốc sạch sẽ ❤️', 'Khách sạn sạch sẽ. Có quán cafe bên dưới khá tiện. Giá hợp lý Chủ khách sạn rất thân thiện và hiếu khách Khá gần biển đi bộ ra biển chỉ mất khoảng 3-5p Điểm trừ duy nhất là hệ thống cách âm chưa tốt. Nhưng với tầm giá này thì đã quá oke rồi ^^']","['Máy lạnh', 'Chỗ đậu xe', 'WiFi']","Giờ nhận và trả phòng
Giờ nhận phòng: 14:00 - 22:00
Giờ trả phòng: 07:00 - 12:00
Bạn muốn nhận phòng bên ngoài khung giờ quy định (ví dụ như sáng sớm hoặc tối muộn)? Bạn có thể thoả thuận trực tiếp với nơi lưu trú!
Vị trí
Minh Thang Hotel Con Dao toạ lạc tại khu vực / thành phố Côn Đảo (Hòn Sơn).","[('Trại giam Phú Hải', '547 m'), ('Sân bay Côn Đảo (VCS)', '6.23 km'), ('Trại giam Phú Hải', '547 m'), ('Vườn quốc gia Côn Đảo', '2.27 km'), ('Bãi biển Đất Dốc', '3.22 km'), ('Sân bay Côn Đảo (VCS)', '6.23 km')]"
Vũng Tàu,Khách sạn Nguyên Hà,"['https://ik.imagekit.io/tvlk/apr-asset/dgXfoyh24ryQLRcGq00cIdKHRmotrWLNlvG-TxlcLxGkiDwaUSggleJNPRgIHCX6/hotel/asset/10035081-dcd4b34e45d245f70634ea9739788519.jpeg?_src=imagekit&tr=c-at_max,h-488,q-40,w-768', 'https://ik.imagekit.io/tvlk/apr-asset/dgXfoyh24ryQLRcGq00cIdKHRmotrWLNlvG-TxlcLxGkiDwaUSggleJNPRgIHCX6/hotel/asset/10035081-49a66853b35e20f1bcb5daf34ce52ed9.jpeg?_src=imagekit&tr=h-116,q-40,w-152', 'https://ik.imagekit.io/tvlk/apr-asset/dgXfoyh24ryQLRcGq00cIdKHRmotrWLNlvG-TxlcLxGkiDwaUSggleJNPRgIHCX6/hotel/asset/10035081-2048x1365-FIT_AND_TRIM-758023a4da1eda7db83e8c9a89d0b10b.jpeg?_src=imagekit&tr=h-116,q-40,w-152', 'https://ik.imagekit.io/tvlk/apr-asset/dgXfoyh24ryQLRcGq00cIdKHRmotrWLNlvG-TxlcLxGkiDwaUSggleJNPRgIHCX6/hotel/asset/10035081-8dd52ca9d3f3c92ae79dc0488a2c2262.jpeg?_src=imagekit&tr=h-116,q-40,w-152', 'https://ik.imagekit.io/tvlk/apr-asset/dgXfoyh24ryQLRcGq00cIdKHRmotrWLNlvG-TxlcLxGkiDwaUSggleJNPRgIHCX6/hotel/asset/10035081-1365x2048-FIT_AND_TRIM-a0eb6c8129eb2dfd1e13d134a51fbd96.jpeg?_src=imagekit&tr=h-116,q-40,w-152']","https://www.traveloka.com/vi-vn/hotel/vietnam/nguyen-ha-hotel-3000010035081?spec=16-07-2022.17-07-2022.1.1.HOTEL.3000010035081.Kh%C3%A1ch%20s%E1%BA%A1n%20Nguy%C3%AAn%20H%C3%A0.1&prevSearchId=1736844834469074900&loginPromo=1&contexts=%7B%22inventoryRateKey%22%3A%22povEwB3ZzsU2C6pd%2B6MdU13LUNuufACdbU0usK5vg0dM0tKsNUio4Rxug1zOzHJilcvZa8YdqqIySdppe7dolTIewZlxfjiOGz6oXLTucMvN0%2BgQ3yZPvZcoHwUFNN%2BZpcr%2F%2FNa8o9ElfN8zOYhzzZeg0X586laFpeUViPi9rxBmwvZ2YEfP4nhoiDGlUr32mhLDdV0WLeT%2FFKfQ0QL8LH02Dvlx%2F8PjYogEE5yzx6g6yOKyKeIDf7jO3GM45O1ok5sYzsZdVhL8yLD1ILOp6Q%3D%3D%22%7D
","81/16 Thùy Vân, Phường 2, Phường 2, Thành phố Vũng Tàu, Bà Rịa - Vũng Tàu, Việt Nam, 791016",1,1.000.000  VND,8.7,143,"['Khi nhận phòng thì thông báo không chịu nhận giữ xe ô tô', 'phòng sạch sẽ, rộng rãi, giá tốt', 'phòng sạch và đẹp, lần sau sẽ ghé tiếp', 'Mình đặt phòng 600k cho phòng nghỉ cuối tuần, tuy nhiên giao cho mình là phòng 540k_chắc là phòng còn lại duy nhất Mà giá không chênh lệch bao nhiêu nên thôi mình không nói làm gì mất thời gian, tuy nhiên cũng viết lên đây để mọi người để ý hơn.', 'Tôi rất hài lòng khi ở đây. Chủ khách dạn rất thân thiện, phòng ốc sạch sẽ và khách sạn rất gần khu ăn uống, biển.', 'mình thấy khách sạn tương đối sạch sẽ nhưng mình nghĩ nếu khách sạn hỗ trợ thanh toán bằng thẻ sẽ tiện hơn, máy lạnh không thể điều chỉnh nhiệt độ nên lạnh quá lạnh. địa điểm gần bãi sau di chuyển thuận lợi. có thể sẽ ghé lại.', 'Ok! Tất cả đều tuyệt. Lần sau chúng tôi sẽ quay lại', 'Khách sạn sạch sẽ, gần biển. Điểm trừ là thằng máy rất nhỏ chỉ đủ 3 người, phòng cách âm không tốt. Nhưng giá như vậy là tạm ổn', 'Phòng không có cách âm, người bên ngoài đi và nói chuyện thì quá ồn trong phòng, cửa nhà về sinh nên làm kính khí.', 'Phòng sạch, nhân viên ok, chú lễ tân buổi tối hơi khó chịu 1 chút, mọi thứ đều xứng đáng với giá tiền']","['Lễ tân 24h', 'Chỗ đậu xe', 'Thang máy', 'WiFi']","Giờ nhận và trả phòng
Giờ nhận phòng: Từ 14:00
Giờ trả phòng: Trước 12:00
Vị trí
Nguyen Ha Hotel toạ lạc tại khu vực / thành phố Phường 2.
Có rất nhiều điểm tham quan lân cận như Bãi Sau ở khoảng cách 0,3 km, và Tượng Chúa Kitô Vua ở khoảng cách 0,82 km.","[('Bãi Sau', '298 m'), ('Sân bay Vũng Tàu', '4.89 km'), ('Bãi Sau', '298 m'), ('Sân golf Vũng Tàu', '4.17 km'), ('Dinh Cô', '17.06 km'), ('Bãi biển Long Hải', '17.16 km')]"
Vũng Tàu,Nhat Anh 2 Hotel,"['https://ik.imagekit.io/tvlk/apr-asset/Ixf4aptF5N2Qdfmh4fGGYhTN274kJXuNMkUAzpL5HuD9jzSxIGG5kZNhhHY-p7nw/hotel/asset/67791874-2189617e994b58321092ddca977be348.jpeg?_src=imagekit&tr=c-at_max,h-488,q-40,w-768', 'https://ik.imagekit.io/tvlk/apr-asset/Ixf4aptF5N2Qdfmh4fGGYhTN274kJXuNMkUAzpL5HuD9jzSxIGG5kZNhhHY-p7nw/hotel/asset/67791874-ee2b5c93cdcad390a35c6500e04e09b9.jpeg?_src=imagekit&tr=h-116,q-40,w-152', 'https://ik.imagekit.io/tvlk/apr-asset/Ixf4aptF5N2Qdfmh4fGGYhTN274kJXuNMkUAzpL5HuD9jzSxIGG5kZNhhHY-p7nw/hotel/asset/67791874-09375351f22462e36956334304ed90c8.jpeg?_src=imagekit&tr=h-116,q-40,w-152', 'https://ik.imagekit.io/tvlk/apr-asset/Ixf4aptF5N2Qdfmh4fGGYhTN274kJXuNMkUAzpL5HuD9jzSxIGG5kZNhhHY-p7nw/hotel/asset/67791874-b85f278207c36ca8e94277fc572bc1b6.jpeg?_src=imagekit&tr=h-116,q-40,w-152', 'https://ik.imagekit.io/tvlk/apr-asset/Ixf4aptF5N2Qdfmh4fGGYhTN274kJXuNMkUAzpL5HuD9jzSxIGG5kZNhhHY-p7nw/hotel/asset/67791874-4efcddf0b4987a72eace4ecbf6524bec.jpeg?_src=imagekit&tr=h-116,q-40,w-152']","https://www.traveloka.com/vi-vn/hotel/vietnam/nhat-anh-2-hotel-9000000809393?spec=16-07-2022.17-07-2022.1.1.HOTEL.9000000809393.Nhat%20Anh%202%20Hotel.1&prevSearchId=1736844834469074900&loginPromo=1&contexts=%7B%22inventoryRateKey%22%3A%22povEwB3ZzsU2C6pd%2B6MdU13LUNuufACdbU0usK5vg0dM0tKsNUio4Rxug1zOzHJilcvZa8YdqqIySdppe7dolTIewZlxfjiOGz6oXLTucMvN0%2BgQ3yZPvZcoHwUFNN%2BZpcr%2F%2FNa8o9ElfN8zOYhzzZeg0X586laFpeUViPi9rxA%2FlWIatAKir3OMMQS6gj2tmhLDdV0WLeT%2FFKfQ0QL8LH02Dvlx%2F8PjYogEE5yzx6g6yOKyKeIDf7jO3GM45O1ok5sYzsZdVhL8yLD1ILOp6Q%3D%3D%22%7D
","36 Trương Văn Bang, Phường 7, Thành phố Vũng Tàu, Bà Rịa - Vũng Tàu, Việt Nam, 78000",1,750.000  VND,7.6,22,"['Phòng nhỏ xinh nhưng tiện nghi, khu lận cận mát mẻ không ồn ào xe, không cần sát biển đâu vì từ khách sạn chạy ra vẫn gần lắm', 'phòng tương đối sạch sẽ nhưng quá nhỏ, đủ để cái giường với lối đi tầm 1m là hết chỗ, máy lạnh thì bị hư không mát xíu nào còn kêu lớn không ngủ đc, không xài được wifi nữa, không vừa với giá 400k/đêm', 'Dịch vụ ổn có thang máy thoáng', 'Motel chứ không phải Hotel. Dịch vụ quá tệ. Mình đến check in thì bà chủ báo không có đơn đặt chỗ của mình. Nhà nghỉ không có trên app. Yêu cầu mình đưa hoá đơn ra. Ok mình đưa. Xem và gọi cho con trai, trách con trước mặt khách: tại sao con không huỷ trên app, mẹ đã dặn con rồi, cuối tuần làm gì có phòng 3-400k mà bán. Không hề có động thái tiếp đón khách, trong khi lỗi (nếu có) thì là lỗi quản lý từ nhà nghỉ. Mình báo đã thanh toán thì bà không tin và kiểm tra đi kiểm tra lại. Sau đó vứt cho mình chiếc chìa khoá phòng như bố thí, không hề có thái độ tiếp khách cơ bản chứ đừng nói là niềm nở. Lúc đó mình quá mệt nên không muốn đôi co, và dù sao chỉ ở tạm một đêm nên lười tìm một khách sạn khác, và cảm thấy bố thid tiền cho thể loại dịch vụ này thì quá uổng. Nói về phòng, phòng mình ở là Superior thì không hề giống trong hình. Phòng nhỏ, bí và có mùi lạ. Đèn cháy hết chỉ còn 1 cái duy nhất. Mình xuống gặp ông chủ và báo về tình trạng đèn, ổng ok sẽ thay cho mình. Đoạn này ok vì xử lý nhanh gọn. Nói chung là né luôn không bao giờ quay lại.', 'Chủ khách sạn muốn tôi hủy booking để lấy phòng lớn hơn với lý do phòng tôi đặt đã bán hết rồi, tôi rất bực mình và không đồng ý thì họ nói sẽ liên lạc với bên app và kêu tôi ngồi chờ sau 5 phút thì đưa cho tôi chìa khoá và đưa lên phòng 501 với cái giường đầy kiến đen và đã cắn tôi cả đêm, khi tôi xuống hỏi vài đều thì cách phục vụ của chủ khách sạn rất tệ không niềm nở thậm chí lúc tôi trả phòng cũng không nở được 1 nụ cười, khăn tắm dơ, có vết ố. Không có được tủ treo đồ ngoài cái móc inox trên tường . Uhm thì giá rẻ nên dịch vụ chỉ có thế nếu tôi có complain, giá với dịch vụ như thế thì cũng chả rẻ, một trải nghiệm thật tệ cho khách sạn xa biển vào thời điểm dịch covid làm ăn như vậy sẽ không bao giờ quay lại', 'Phòng sạch sẽ cửa sổ thoáng mát nhân viên lịch sự, giá cả phải chăng, chắc chắn sẽ quay lại.', 'Phòng khá ổn. Lễ tân dễ thương']",[''],"Giờ nhận và trả phòng
Giờ nhận phòng: 14:00 - 22:00
Giờ trả phòng: 01:00 - 12:00
Bạn muốn nhận phòng bên ngoài khung giờ quy định (ví dụ như sáng sớm hoặc tối muộn)? Bạn có thể thoả thuận trực tiếp với nơi lưu trú!
Vị trí
Lưu trú tại Nhat Anh 2 Hotel là một lựa chọn đúng đắn khi quý khách đến thăm Phường 7.","[('Sân bay Vũng Tàu', '1.59 km'), ('The Statue of Gautama Buddha', '1.81 km'), ('Sân golf Vũng Tàu', '2.58 km'), ('Bãi Sau', '3.78 km'), ('Dinh Cô', '16.49 km'), ('Bãi biển Long Hải', '16.64 km')]"
Vũng Tàu,Hi You 2 Hotel,"['https://ik.imagekit.io/tvlk/apr-asset/dgXfoyh24ryQLRcGq00cIdKHRmotrWLNlvG-TxlcLxGkiDwaUSggleJNPRgIHCX6/hotel/asset/20056561-50aeebfa300e64146a2b2a91dec931d2.jpeg?_src=imagekit&tr=c-at_max,h-488,q-40,w-768', 'https://ik.imagekit.io/tvlk/apr-asset/dgXfoyh24ryQLRcGq00cIdKHRmotrWLNlvG-TxlcLxGkiDwaUSggleJNPRgIHCX6/hotel/asset/20056561-1f41f09829c571847218392b91645f17.jpeg?_src=imagekit&tr=h-116,q-40,w-152', 'https://ik.imagekit.io/tvlk/apr-asset/dgXfoyh24ryQLRcGq00cIdKHRmotrWLNlvG-TxlcLxGkiDwaUSggleJNPRgIHCX6/hotel/asset/20056561-781a96531e3ccf81cc43450c1008b5e9.jpeg?_src=imagekit&tr=h-116,q-40,w-152', 'https://ik.imagekit.io/tvlk/apr-asset/dgXfoyh24ryQLRcGq00cIdKHRmotrWLNlvG-TxlcLxGkiDwaUSggleJNPRgIHCX6/hotel/asset/20056561-03b2f1d090657611f5a291e9fe65698d.jpeg?_src=imagekit&tr=h-116,q-40,w-152', 'https://ik.imagekit.io/tvlk/apr-asset/dgXfoyh24ryQLRcGq00cIdKHRmotrWLNlvG-TxlcLxGkiDwaUSggleJNPRgIHCX6/hotel/asset/20056561-d12da0569fde60fa156110e16e2e3a4e.jpeg?_src=imagekit&tr=h-116,q-40,w-152']","https://www.traveloka.com/vi-vn/hotel/vietnam/hi-you-2-hotel-9000000984875?spec=16-07-2022.17-07-2022.1.1.HOTEL.9000000984875.Hi%20You%202%20Hotel.1&prevSearchId=1736844834469074900&loginPromo=1&contexts=%7B%22inventoryRateKey%22%3A%22povEwB3ZzsU2C6pd%2B6MdU13LUNuufACdbU0usK5vg0dM0tKsNUio4Rxug1zOzHJilcvZa8YdqqIySdppe7dolTIewZlxfjiOGz6oXLTucMvN0%2BgQ3yZPvZcoHwUFNN%2BZpcr%2F%2FNa8o9ElfN8zOYhzzZeg0X586laFpeUViPi9rxCIw5T1bFTLDvuapLTPV34gmhLDdV0WLeT%2FFKfQ0QL8LH02Dvlx%2F8PjYogEE5yzx6g6yOKyKeIDf7jO3GM45O1ok5sYzsZdVhL8yLD1ILOp6Q%3D%3D%22%7D
","E4 - 1/27, Đường Chí Linh 26, TTDT Chí Linh, Phường 10, Thành phố Vũng Tàu, Bà Rịa - Vũng Tàu, Việt Nam, 70000",2,650.000  VND,0,2,[],"['Máy lạnh', 'Lễ tân 24h', 'Chỗ đậu xe', 'WiFi']","Giờ nhận và trả phòng
Giờ nhận phòng: Từ 13:00
Giờ trả phòng: Trước 12:00
Vị trí
Lưu trú tại Hi You 2 Hotel là một lựa chọn đúng đắn khi quý khách đến thăm Phường 10.
khách sạn sở hữu vị trí đắc địa cách sân bay Sân bay Vũng Tàu 2,45 km.","[('Sân golf Vũng Tàu', '1.65 km'), ('Sân bay Vũng Tàu', '2.45 km'), ('Sân golf Vũng Tàu', '1.65 km'), ('Bãi Sau', '5.93 km'), ('Dinh Cô', '13.06 km'), ('Bãi biển Long Hải', '13.23 km')]"
Vũng Tàu,Garden House Con Dao,"['https://ik.imagekit.io/tvlk/apr-asset/Ixf4aptF5N2Qdfmh4fGGYhTN274kJXuNMkUAzpL5HuD9jzSxIGG5kZNhhHY-p7nw/hotel/asset/67801214-a9b4a90c056bb3aa0ba8ad8db7b2a071.jpeg?_src=imagekit&tr=c-at_max,h-488,q-40,w-768', 'https://ik.imagekit.io/tvlk/apr-asset/Ixf4aptF5N2Qdfmh4fGGYhTN274kJXuNMkUAzpL5HuD9jzSxIGG5kZNhhHY-p7nw/hotel/asset/67801214-005d920557fca088bcc70f4750dae3fe.jpeg?_src=imagekit&tr=h-116,q-40,w-152', 'https://ik.imagekit.io/tvlk/apr-asset/Ixf4aptF5N2Qdfmh4fGGYhTN274kJXuNMkUAzpL5HuD9jzSxIGG5kZNhhHY-p7nw/hotel/asset/67801214-ef455d7b78eddd3000eda5c5046268e7.jpeg?_src=imagekit&tr=h-116,q-40,w-152', 'https://ik.imagekit.io/tvlk/apr-asset/Ixf4aptF5N2Qdfmh4fGGYhTN274kJXuNMkUAzpL5HuD9jzSxIGG5kZNhhHY-p7nw/hotel/asset/67801214-9af775cbaee680453cb10765e2281fbf.jpeg?_src=imagekit&tr=h-116,q-40,w-152', 'https://ik.imagekit.io/tvlk/apr-asset/Ixf4aptF5N2Qdfmh4fGGYhTN274kJXuNMkUAzpL5HuD9jzSxIGG5kZNhhHY-p7nw/hotel/asset/67801214-05fbffa94921b348b63900341f01c0bc.jpeg?_src=imagekit&tr=h-116,q-40,w-152']","https://www.traveloka.com/vi-vn/hotel/vietnam/garden-house-con-dao-9000000927288?spec=16-07-2022.17-07-2022.1.1.HOTEL.9000000927288.Garden%20House%20Con%20Dao.1&prevSearchId=1736844834469074900&loginPromo=1&contexts=%7B%22inventoryRateKey%22%3A%22povEwB3ZzsU2C6pd%2B6MdU13LUNuufACdbU0usK5vg0dM0tKsNUio4Rxug1zOzHJilcvZa8YdqqIySdppe7dolTIewZlxfjiOGz6oXLTucMvN0%2BgQ3yZPvZcoHwUFNN%2BZpcr%2F%2FNa8o9ElfN8zOYhzzZeg0X586laFpeUViPi9rxDpIPCgA4fnQcdd0mMFrOVZmhLDdV0WLeT%2FFKfQ0QL8LH02Dvlx%2F8PjYogEE5yzx6g6yOKyKeIDf7jO3GM45O1ok5sYzsZdVhL8yLD1ILOp6Q%3D%3D%22%7D
","Khu 2, Phan Chu Trinh, Côn Đảo (Hòn Sơn), Bà Rịa - Vũng Tàu, Việt Nam, 78000",1,639.900  VND,9.2,21,"['Phòng sạch sẽ, thơm mùi tinh dầu. Chị chủ rất vui vẻ, thân thiện, cho check-in phòng sớm, check out trễ cũng không tính thêm tiền. Mặc dù không nằm gần khu chợ nhưng lại gần sân bay hơn.', 'Lần đầu gặp anh chị chủ nhưng cảm thấy thoải mái, thân thuộc như người quen lâu lắm rồi. Phòng sạch sẽ tiện nghi, dọn dẹp mỗi ngày. Đặc biệt yêu thích cái khu vườn hoa và vườn rau của khách sạn. Nói chung thích không khí nơi đây lắm. Giá lại rất hợp lý. Sẽ quay lại bất cứ khi nào đi Côn Đảo.', 'Chủ nhà thân thiện, hiếu khách. Phòng khách sạn rộng rãi thoải mái, mới, sạch sẽ. Đoàn mình có 10 người ai cũng thích lưu trú tại nơi đây và thích nhất sự hiếu khách của chủ nhà.', 'Hotel vô cùng sạch sẽ, phòng ốc rộng rãi thoáng mát, đặc biệt có cho thuê xe máy giá rẻ. Có một khu vườn tuyệt đẹp để khách thư giãn. Có bếp để nấu nướng làm tiệc sân vườn Hài lòng 100%', 'Cô chú chủ nhà nhiệt tình, thân thiện, phòng ốc mới xây sạch sẽ đầy đủ tiện nghi, không quá xa trung tâm, có dịp chắc chắn sẽ quay lại. Cám ơn cô chú rất nhiều', 'Thực sự kháchsạn cực kỳ cực kỳ tuyệt vời. Cô chủ kháchsạn rất nhiệt tình và thân thiện', 'cô chủ rất nhiệt tình, dễ thương. Cô hỗ trợ đặt lịch viếng mâm lễ, mọi thứ đều lo chu đáo cho khách từ a-z. tuy hơi xa trung tâm nhưng phòng đẹp và sạch sẽ đủ tiện nghi. Sẽ tiếp tục ủng hộ lâu dài hihi', 'Đẹp , chủ lịch sự thân thiện . Noi chung là ok lắm ạ!', 'Gia đình tôi đã có một trải nghiệm tuyệt vời ở Garden House Côn Đảo. Khách sạn có một khu vườn rất đẹp, lãng mạn và mát mẻ. Chị chủ kháchsạn cực kỳ nhiệt tình, thân thiện. Chúng tôi còn được tạo điều kiện sử dụng khu bếp và khu bbq cho bữa tối (gia đình đi chợ Côn Đảo tự mua hải sản và chế biến nên giá cả và hương vị rất ok). Nếu có dịp quay lại gia đình tôi chắc chắn vẫn sẽ chọn Garden House vì mức giá vô cùng hợp lý, phòng ốc rộng rãi, thơm mát, chu đáo (có hỗ trợ cả máy giặt ủi trên sân thượng). Thường mình chỉ chấm 1 kháchsạn ở mức điểm 9.5/10 nhưng Garden House có suy nghĩ bảo vệ môi trường (mỗi phòng trang bị máy nước nóng lạnh chứ không sử dụng chai nhựa) và khu vườn xanh mát nên mình rất sẵn lòng vote 10+/10 ạ.', '']","['Lễ tân 24h', 'WiFi']","Giờ nhận và trả phòng
Giờ nhận phòng: Từ 14:00
Giờ trả phòng: Trước 12:00
Vị trí
Garden House Con Dao toạ lạc tại khu vực / thành phố Côn Đảo (Hòn Sơn).
Có rất nhiều điểm tham quan lân cận như Trại giam Phú Hải ở khoảng cách 1,76 km, và Bãi biển Đất Dốc ở khoảng cách 1,76 km.","[('Trại giam Phú Hải', '1.76 km'), ('Sân bay Côn Đảo (VCS)', '4.05 km'), ('Trại giam Phú Hải', '1.76 km'), ('Bãi biển Đất Dốc', '1.76 km'), ('Vườn quốc gia Côn Đảo', '1.86 km'), ('Sân bay Côn Đảo (VCS)', '4.05 km')]"
